送你一个千层月饼，一层想念，二层关心，三层思恋，四层关爱，五层祝愿，六层开心，七层快乐，八层甜蜜，九层幸福，十层是面，千层想见面！中秋快乐！,"4,5"
龙腾盛世，月满乾坤，家国美满，和谐天下；国庆献礼，幸福有你，中秋献礼，祝福给你；开心伴你，富贵找你，健康烦你，美满挽你，双喜临门，一生温馨。,4
中秋月儿圆又圆，亲朋好友在身边，摆满月饼和糕点，香香月饼嘴馋馋，一口下去少半边，含在嘴中粘又粘，吃起月饼甜又甜，祝福写下好祝愿，亲朋好友皆平安，日子幸福又美满，中秋节日乐无边。,2
八月十五是中秋，一轮明月分外圆；把酒言欢度中秋，心情舒畅笑盈盈；欢聚一堂庆团圆，热热闹闹心欢喜；吃块月饼甜透心，福寿安康乐无边；发条祝福送给你，中秋快乐乐逍遥！,4
中秋节，我以心为弦，思念为谱，祝福为歌，为你奏响月圆交响曲，祝你日子红红火火，事业圆圆满满，亲人团团圆圆，心事花好月圆，幸福美满永在前，中秋节快乐！,2
据“中秋特别法”，判你“快乐无期徒刑”，剥夺“郁闷权利”终身，并处“没收全部疾病烦恼”，本判决为“终审判决”，立即执行。祝人月同圆、快乐永远！,5
月有阴晴圆缺，人生别样风景：月圆如诗，月缺如画，月升如舞，月隐如歌，月明如镜，月晦如烟，月移如风，月静如水。中秋佳节，月色撩人，祝你好心情！,4
中秋节我的问候口感细腻，愿你工作游刃有余！中秋节我的祝福质量上乘，愿你生活心想事成！中秋节我的祝福营养健康，愿你爱情四溢芳香！中秋节我的心意传统经典，愿你全家吉庆团圆！,0
月照穹宇晚晴天，良辰美酒游子还，遍步大江南北处，终是乡音动心弦。阖家团坐笑语暖，对天高歌融秋寒，觥筹交错千杯醉，张灯结彩福寿全！嫦娥曼舞做遥祝：中秋佳节共此欢！,"0,4"
月色莹莹且明媚，祝福平常却珍贵；金菊怒发香袭人，中秋祝福携真诚；嫦娥起舞玉兔忙，传福人间添吉祥。值此传统中秋佳节就到之际，祝合家欢，幸福长！,0
不要抱怨妈妈没有给你买月饼吃，因为很多人此时正在异乡无法回家团圆；不要抱怨你在异乡无法回家，因为很多人孤孤单单没有家，没有温暖；不要抱怨中秋节没有人给你送祝福，因为还有我。中秋快乐！,4
喝香槟，赏明月，中秋国庆一起过。月饼酥，红旗红，双份快乐是不同。爱国情，东篱下，笑着喝完菊花茶。中庭月，后庭宴，国泰民安人团圆。祝福你，双份的，健康幸福都有的。双节快乐！,4
月是中秋分外明，祝你天天好心情；皓月当空洒清辉，美好事儿一堆堆；祝愿佳节多喜庆，以后天天走好运！,0
最近老是心律失常，半夜醒来汗流如浆，没事就去翻翻日历，心里紧张得早已变样。谁想跟我抢占中秋祝福的沙发？哼，想都别想！预祝中秋快乐，喜气洋洋！,5
中秋之夜我在月宫宴请客人，为大家准备丰盛的晚餐清蒸浪漫，红烧祝福，水煮团圆，油炸快乐糕，真诚温馨汤，十分开心果，温暖幸福酒。敬请光临。,5
千好万好事事好，月圆情圆人团圆，祝：中秋节快乐，万事如意，心想事成！,0
中秋月儿圆又圆，圆圆祝福送面前：衷心“圆”你与快乐喜结良“圆”，与好运共续情“圆”，财运“圆圆”不断，住进成功家“圆”，处处都有好人“圆”，幸福“圆”份天注定。合家圆圆满满，一生花好月圆。,0
做一只月饼送你，揉进我对你美好的祝愿；捧一轮明月送你，代表我真挚的情意；写一条祝福发你，在这中秋佳节即将到来的时候，祝愿日子越过越精彩！,4
中秋明月。皎洁的月光展开一方素笺，布满星辰晶莹的语言，让风为我送出思念的音讯，与远方的亲朋一同赏月，共度良宵。衷心祝愿您们中秋佳节，开心快乐，平安健康。,2
中秋来到月儿圆，抬头望月许心愿，希望朋友人人好姻缘，盼望兄弟日日佳人约，渴望姐妹事事合心愿，期望亲人幸福到永远。祝愿亲人，朋友们，中秋月下许心愿，生活快乐幸福一万年。,"2,4"
中秋佳节到，送你八轮月，身体“月”来“月”好，笑容“月”来“月”甜，工资“月”来“月”多，生活“月”来“月”美好，祝你中秋节快乐。,4
桂香飘摇月呈圆，秋菊献媚开满园，浪子不惧路途远，千里迢迢赴团圆，升学升职完心愿，全家老小美梦圆，生意赢得百万元，庆祝酒香溢宅院。中秋佳节万物圆，祝君一生事事圆，幸福好运到永远。,4
中秋之夜，快递员嫦娥会送你一个我亲手做的电子月饼，它饱含思念，裹着真情，低碳环保，不含添加剂。不管你信不信，反正我寄了。中秋快乐！,5
举杯仰天遥祝：月圆人圆花好，事顺业顺家兴。,4
国庆中秋齐相遇，月圆国圆共欢腾；万家团圆意相同，普天同众双重喜；烟花白鸽齐绽放，张灯结彩贺双节；祝福祖国寿无疆，祝福朋友阖家欢！双节快乐！,双节
红旗飘扬爱国情，一轮明月一盘饼。清辉后园花弄影，人旺家和一国兴。金风送来国祥瑞，玉露倒映人团圆。国庆紧随中秋至，国运昌盛如明月。花团锦簇庆国庆，其乐融融过中秋。国富民安，双节快乐！,双节
中秋明月映照国庆，国庆鲜花簇拥团圆，明月圆圆幸福满满，月饼香香生活甜甜。国庆中秋双节合璧，双重祝福统统送你：祝福你爱情幸福双宿双飞，生活幸福双喜临门，喜鹊登枝喜上加喜，五福进门福上添福。,双节
我们的距离虽然远，但是你永远挂在我心中，就如八月十五这一天，希望永远记的我，中秋节快乐。,4
中秋夜，花好月圆合家团圆；国庆节，神舟大地繁花似锦；双节合璧，同庆同圆，共寄相思齐祝愿；在这美好的日子愿我最真挚的问候陪你渡过，祝你双节快乐，万事如意，家和万事兴。,双节
爱一年恨一年缘份啊你一条我一条谢谢啊过一天美一天哲学啊走两步是两步开心啊苍天啊大地啊,9
中秋佳节至，国庆大假来。祝君时时开心果，刻刻幸运星，岁岁平安符，年年健康身！,4
中秋将至，送上一个月饼，配料：五克快乐枣，一把关心米，三钱友情水，用幽默扎捆，用手机送达；保质期：农历八月十五前；保存方法：请按存储键。,9
八月中秋月儿圆，对着嫦娥表思念，心中的人啊你可看见，嫦娥也在默默祝愿，愿你生活比蜜甜！,4
把酝酿已久的创意交给秋风，任其去演绎相思的旋律；让翘盼团聚的心跃上太空，在月宫桂树下再叙永恒的主题。,6
春有百花秋望月，夏有凉风冬听雪，心中若无烦恼事，便是人生好时节，愿你晨有清逸暮有悠闲，梦随心动心随梦求，祝中秋节愉快！,4
风柔雨润花好月圆，幸福生活好甜！冬去春来似水如烟，一年中秋在眼前！流年不复返，人生须尽欢。中秋快乐！,4
嗨，嫦娥让我给你带个话，今年中秋给她留点月饼渣，她明年会给你送个大金月饼。祝中秋节快乐！,5
嗨，嫦娥让我给你捎个话：你昨晚如此含情脉脉地凝望她，让她心跳加快，一夜未眠，拜托今天你不要再用目光骚扰她啦,9
后羿忙射日，嫦娥偷奔月。月老不曾老，自古情难了。中秋月儿挂，心中圆往事。玉兔伴嫦娥，绢带千古绕相思。,9
八月十五将至，送你一只月饼，含量：100关心，配料：甜蜜快乐开心宽容忠诚幸福；保质期：一辈子；保存方法：珍惜。,3
八月中秋不送礼，发条祝福祝福你，健康快乐长伴你，好运和你不分离，还有让我告诉你，财神已经跟随你。,4
又是一年月圆夜，月下为你许三愿：一愿美梦好似月儿圆，二愿日子更比月饼甜，三愿美貌犹如月中仙。,9
愿你过的每一天都象十五的月亮一样成功圆满。,4
一别之后，两地相思，只说是三四天，有谁知五六月？七夕相聚太遥远，八月半月圆人盼圆，九重登高把你念，十里长街望穿秋水！祝中秋快乐！,4
悠悠的云里有淡淡的诗，淡淡的诗里有绵绵的喜悦，绵绵的喜悦里有我轻轻的问候，祝中秋快乐！,4
中秋月圆圆，月饼甜又甜。平安的馅，幸福的皮，人民币的盒子，铂金的绳。交给祝福当快递，附个名片是团圆。祝中秋愉快！,9
天苍苍，野茫茫，今年奖金太渺茫！水弯弯，路长长，没钱的日子太漫长！楼高高，人忙忙，今夜能否与你结伴抢银行暗号：中秋快乐！,5
流星划过天际，我错过了许愿；浪花拍上岩石，我错过了祝福；故事讲了一遍，我错过了聆听；人生只有一回，我庆幸没错过你这个朋友！祝中秋快乐！,4
就知道中秋那天你会被铺天盖地的祝福包围，英明的我今天就让祝福跨过高山越过高楼穿过大街小巷，闪过卖茶叶蛋的老太太，钻进你的手机：中秋快乐！,"4,5"
一个月亮一个你，二个影子我和你，三生有幸认识你，四个月来好想你，五湖四海寻找你，六神无主迷恋你，七星伴月围绕你，八月十五祝福你。,4
中秋佳节，送你四个月饼：送你莲蓉的，愿你漂亮胜芙蓉；送你五仁的，愿你朋友遍五洲；送你水果的，愿你做个开心果；送你巧克力的，愿生活甜如蜜。,4
圣旨到！奉天承运，皇帝诏曰；中秋将至，特赐红包一个，内有幸福万两，开心万两，快乐万两，青春万两，笑容万两，愿你饱尝幸福快乐之微笑。钦此！,5
思念像中秋的满月，牵挂似漫天的繁星，在这欢乐的节日，借着柔柔的风，谱上长长的祝福，轻轻飘到你身边。祝中秋愉快！,4
中秋将至，送上一个月饼，配料：五克快乐枣，一把关心米，三钱友情水，用幽默扎捆，用手机送达；保质期：永久；保存方法：请按存储键。,5
秋江潮水连海平，海上明月共潮生，花好月圆人团聚，祝福声声伴你行。祝你中秋愉快，幸福一生！,"0,4"
十五月亮圆又圆，打制的月饼甜又甜，嫦娥仙女来做馅，玉兔宝宝忙做皮，月洒银辉做封面，星解点点做提绳。中秋到了，祝开心快乐！,4
天气变得好快，凉风悄悄袭来，晚上毯子要盖，别把脚丫冻坏，没事叨根骨头，那样可以补钙，不要再骂我坏，祝你中秋愉快。,5
心到想到得到，看到闻到吃到，福到运到财到，中秋节还没到，但愿我的祝福是第一个到，提前祝你中秋节快乐！,4
祝你忙中有闲，兜中永远有钱，身边好人相伴，容颜永驻今天，人生目标一直向前，日子越过越甜，如此年复一年！中秋快乐！,"0,4"
我将你的手机号告诉了个陌生人，他叫月老，他会在中秋月圆夜帮我告诉你：我心思你，我心念你，祝你中秋快乐，幸福如意。,"3,4"
采一轮松间明月供你观赏，织一件秋日的凉爽为你披上，斟一杯月宫的琼浆醉你心上，做一份中秋的祝福圆你梦乡。祝中秋快乐！,4
人说每逢佳节倍思亲，我道思亲之时更思你。想你就在月圆时。,6
月到中秋分外明，人到中秋望团圆！祝您节日快乐！合家团圆！,"0,2"
在这月圆的时刻，我送一个迟到的祝福，愿你梦圆，情圆，人更圆。,4
中秋的月儿圆又圆，我的月亮却少半边。千里遥寄相思苦，何年何月现欢颜？,6
虽然没能吃到你的月饼，但我们想把我们波涛般的心情传递给你。,4
亲情爱情，情系佳节。家园月圆，圆满中秋。,"0,2,4"
在这特别的日子里，送一份淡淡的清香，为你洒脱缤纷的祝福！远方的你，中秋节快乐！,4
国庆又逢仲秋月圆，伟大祖国大好河山，蒸蒸日上繁荣富强，神州共奔富丽康庄。,双节
亲情爱情，情系佳节。家园月圆，圆满中秋。,9
越是月圆时，越是思念深爱的你！月亮代表我的心我爱你！,3
在这特别的日子里，送一份淡淡的清香，为你洒脱缤纷的祝福！远方的你，中秋节快乐！,9
明月知我心，思念与日增，总想相依诉衷情，无奈人两地，永远祝福你！,3
在中秋之夜，一同望着那轮明月读一份相思，一份牵挂，还有那缺憾的美，永恒的爱，好吗？,3
中秋来了，月光如水。想牵着你的手，一同享受月光浴，无奈你我天各一方！,9
深秋，又是一个思念的季节，我把思念写进贺卡，把祝福融入心田，想念，年年月月！,"1,3"
月圆年年相似，你我岁岁相盼。那满天的清辉，遍地水银，便是我们互倾的思念。,3
中秋，国庆，双喜临门；你侬，我侬，两心相许；欢乐，幸福，别无它感！,双节
执手相看泪眼，竟无语凝噎。念去去、千里烟波，暮霭沉沉楚天阔。多情自古伤离别，更那堪、冷落清秋节！,6
月圆年年相似，你我岁岁相盼。那满天的清辉，遍地水银，便是我们互倾的思念。,9
明月知我心，思念与日增，总想相依诉衷情，无奈人两地，永远祝福你！,9
秋天清，秋月明；落叶还散，栖复惊。相思相见知何日，此时此夜难为情。,"3,6"
在这特别的日子里，送一份淡淡的清香，为你洒脱缤纷的祝福！远方的你，中秋节快乐！,4
中秋佳节至，国庆大假来。送君：时时开心果，刻刻幸运星，岁岁平安符，年年健康身！,双节
国庆中秋双双庆，在这个特别、美好、难忘的日子里，让我们所有的华夏子孙共祝愿祖国盛！家团圆！人幸福！,双节
酒越久越醇，朋友相交越久越真；水越流越清，世间沧桑越流越淡。国庆重阳两佳节，何不把酒言欢共话巴山夜雨？,9
朋字双月并肩行，远隔千里两地明；祝友健康阂家乐，事业顺利展宏程；国庆佳节同喜日，捧杯聚首秋月中。,4
圆圆的月亮象面镜，你的心思能看见。幽幽的夜色是张幕，我的星愿不可数。,6
明月千里难以触摸，对你的思念无处寄托。举杯邀明月，请她对你说：福多！钱多！快乐多！,4
将我的真心，放在你的手心，愿你好好珍藏，细细呵护！,9
中秋佳节到了，我要把一年来对你的思念诉说给月老听！,3
举头望皓月，凝思意中人。若得尔陪伴，一生终无憾！,3
千里试问平安否且把思念遥相寄。绵绵爱意与关怀，浓浓情意与祝福，中秋快乐,9
海上生明月，天涯共此时。举杯邀明月，共贺中秋时。,4
春天来了又走了，秋日的火焰灼遍林间，但记忆的小河春天永存。,9
国庆巧遇中秋万家欢，人生适逢盛世精神爽。祝您节日愉快、合家团圆，与时俱进、心想事成。,双节
露从今夜白，月是绞乡明。今夜月正圆，正是思乡时。,6
九夏芳辰八埏共庆，一轮明月两岸同圆,政治
中秋月圆合家欢，举杯邀月心莫烦；夫妻恩爱把心连，家庭和睦人间暖；幸福花儿一串串，细细品味心里欢；小康路上齐向前，不管刮风下雨难；葡萄美酒再斟满，快乐幸福金不换！,"0,2,4"
中秋十五的圆月，缓缓升起在天空，她把自己的光亮，把爱心洒向世人，让世界五彩缤纷。中秋佳节节到了，祝领导：合家团圆甜蜜蜜，幸福安康如心意，工作顺利圆满满，钱包满满喜洋洋。,0
月缺月圆是自然的现象，聚散离别是人世的演变，故乡亲人是心中的牵绊，吉祥如意是真挚的祝愿。在中秋节这团圆的日子里，愿您亲情铭记心头，友情脉脉相守，爱情不离左右。中秋快乐！,0
中秋佳节月儿圆又圆，圆出阖家团聚，千里亲情祝福一线牵，传达温馨团圆喜笑颜，中秋节虽不能送你月饼尝鲜，但送你一份祝福的心情：中秋节日里快乐相伴，家庭团圆幸福更美满！,"0,4"
中秋节送你神奇月饼。甜蜜做馅儿，幸运做面儿，美丽做包装，快乐做标签儿。吃一口事业成功，吃两口爱情甜蜜，吃三口阖家团圆，全吃完顺风顺水万事如意！,5
月圆情圆人团圆，人满福满酒杯满，花香景美心情美，你乐我乐全家乐，佳节喜闹大团圆，万事顺畅皆圆满。朋友，愿你合家团圆，一生圆满，生活甜美，快乐至上。祝中秋节快乐！,4
月圆圆月团圆夜，团圆夜里望月圆，月圆夜圆月圆圆，夜圆月圆夜团圆，中秋来临送祝愿，愿你福气满家园，事圆人团圆，梦圆圆梦梦儿圆！祝中秋快乐！,"0,4"
月影摇晃着欣喜，快乐洋溢着心底，花朵飘香着日子，月饼甜美着惦记，心愿徜徉着欢喜，祝福泛动着涟漪，心绪调剂着消息，只为送给你，祝愿你中秋如意。,"0,4"
月色莹莹且明媚，祝福平常却珍贵；金菊怒发香袭人，中秋祝福携真诚；嫦娥起舞玉兔忙，传福人间添吉祥。值此传统中秋佳节就到之际，祝合家欢，幸福长！,"0,2,4"
月圆的时候更想你，千万回忆甜蜜堆积；中秋的时候更念你，欢声笑语快乐依稀。遥祝远方的你中秋愉快，万事如意。记得看月亮的时候替我笑嘻嘻，那是我送你的赠礼。,"3,4"
中秋到了，有好吃的吃喽。红枣，红豆，花生，芝麻，凤梨，草莓，哈密瓜，芒果，冰激凌，哈哈，流口水了没有？什么？你没有吃？这么多月饼馅你竟然没发现！哈哈，中秋快乐！,5
又是一年落叶黄，一层秋雨一层凉。整日工作挺辛苦，天凉别忘加衣裳。保重身体多餐饭，珍惜友情常想想。信短情长言未尽，唯愿朋友多安康。中秋快乐，合家团圆,4
天上有圆月如盘，人间有我的问候。圆月皎皎且明媚，祝福平常却珍贵。请把我的祝福做成书签，放在你的枕边，愿你中秋快乐，阖家幸福！,4
月中桂花又飘香，人间月饼味芬芳。玉兔携福祝团圆，嫦娥起舞送吉祥。花好月圆人安康，良辰美景共分享。和和美美万事安，团团圆圆美景赏。中秋将至喜庆扬，祝君幸福绵绵长。祝你中秋快乐，合家幸福。,4
左手握住健康，右手抓住财富。左腿跨过艰难险阻，右腿踏上成功之路。用力喊出幸福，用心感受我这中秋祝福：中秋快乐！,4
幽夜，倚窗，抬头，望月，明月装饰了你的窗子，你装饰了我的梦；月饼，相思，真情，永恒，月饼融入了我的思念，我许下了最美的祝愿，愿你中秋快乐。,"3,6"
嫦娥月轻舞，玉兔喜洋洋；吴刚酿美酒，月桂飘醇香；金菊展笑颜，人间乐淘淘；亲朋互拜访，儿女绕身旁；中秋佳节日，品饼共赏月！团圆享天伦，幸福乐逍遥。,"0,2,4"
秋风吹，斜阳照，菊花朵朵对你笑；月儿圆，月饼甜，祝福祝福送祝愿。愿你幸福甜蜜乐无边！健康平安到永远！中秋快乐！,"0,4"
一壶桂花酒，送给好朋友。两碟月饼香，绵绵情意长。三生实有幸，愿你烦恼尽。四季月常圆，快乐又悠闲。五福又临门，愿你倍精神。六六事业顺，成功把你随。七喜人陶醉，幸福把你围。中秋节快乐！,4
中秋之夜，快递员嫦娥会送你一个我亲手做的电子月饼，它饱含思念，裹着真情，低碳环保，不含添加剂。不管你信不信，反正我寄了。中秋快乐！,5
月华如霜，浸入你的心房；微风送爽，吹去你的忧伤；星光拂窗，照亮你的方向；白云流芳，祝福送你身旁。中秋愉快！,4
中秋的祝福是一份真心意，不用千言，不用万语。一条小小的祝福，带着我心中的思念，遥寄这份祝福给你：中秋快乐！,4
最近老是心律失常，半夜醒来汗流如浆，没事就去翻翻日历，心里紧张得早已变样。谁想跟我抢占中秋祝福的沙发？哼，想都别想！预祝中秋快乐，喜气洋洋！,5
风干月光，把日子酿出美妙韵味；剪裁海潮，把思念裹出浪花味道；珍藏繁星，编织一串幸福珠宝，在中秋的时候把这一切送给你，愿花好月圆包围你！,4
中秋将至，奉上一个月饼，配料：五克快乐枣，一把关心米，三钱友情水，用幽默扎捆，用手机送达；保质期：农历八月十五前；保存方法：请按保存键。,9
不必多说，将真情融进字句里；不必牵挂，这月儿照着我也照着你；不需微风，黄叶也会写下美丽的寄语；不需祝福，中秋前夕，知道你一定也快乐惬意！,4
月是中秋分外明，我用祝福传真情；相思包着财运到，幸福裹着福运跑；浪漫甜蜜融其中，天天相伴好心情；借问月饼知多少？祝福一条不能少。,4
四季交替有了金秋的美丽，岁月流转有了想你的心情，祝福传递有了问候的美丽，中秋来临有了真诚的祝福：愿你人生梦想圆，合家团聚笑开颜。,"0,4"
中秋节祈福：事业顺利是一福，生活美满是一福；爱情甜蜜是一福；儿孙满堂是一福；友人挂记是一福；身体健康是一福；全家团圆福上加福！,"0,4"
丰收这幸福做陷，聚集这快乐做皮，取这天上的月亮为模型，为你做这世界上最为圆满的月饼，希望你中秋佳节人月两团圆，中秋节快乐。,4
把酝酿已久的创意交给秋风，任其去演绎相思的旋律；让企盼团聚的心跃上太空，在月宫桂树下再续永恒的主题。中秋佳节来临之际，愿你心情如秋高气爽，笑脸如鲜花常开！,"0,4"
取快乐无忧之泉，和健康平安之面，捏花好月圆之皮，包甜蜜幸福之馅。用关怀体贴之火烘烤，以思念祝福之信传递，送上特制月饼，祝中秋快乐！,4
丹桂要笑，香气缭绕；金菊要笑，倩影摇摇；圆月要笑，中秋欲临，佳节要到。我也要笑，提前准备，祝福早到：愿你情圆事圆人团圆，吉祥如意享美好！,4
八月金秋桂送香，十五明月情溢边。丹桂香郁是千里，明月寄情是惬意。一缕香入魂，乐在此中行，为你行，为我行，快乐随行。为你行，为我行，祝福行！,4
中秋节到了，我代表月光一族，祝你：月薪加倍，月月发财，月进斗金，月月有余，住月宫级别墅，吃钻石级月饼，再来一张金卡级月票，提供无限期透支！,5
我在脚下画了下点，叫圆心；我用真诚、尊重划线，叫半径。我用圆心和半径组合成个圆，只为在中秋之际送你个圆圆的祝福：愿你月圆人更圆！,4
有一句话存在心里很久，怕暴雨把它淋湿，怕狂风把它吹走，怕寒气把它冰冻，怕烈日把它晒透，终于盼到中秋佳节，我想对你说出口：祝你中秋节快乐！,4
高空依旧明月挂，夜色伴着银光洒。此时正是中秋时，思念之情尤其浓。团圆月饼寄回家，祝愿快乐幸福呀！祝福祝福寄回家，祝愿生活美满啊！,"0,2,4"
月是中秋明，景色分外好；桂花飘雪远，幸福花枝俏；嫦娥寒宫舞，吉祥迎头绕；玉兔遍地跑，团圆度良宵；祝福情谊深，真挚问候到；祝你总如意，幸福合家笑；快乐中秋节，事业步步高！,0
风柔雨润花好月圆，幸福生活好甜！冬去春来似水如烟，一年中秋在眼前！流年不复返，人生须尽欢。中秋快乐！,4
桂花随风起，香意万里行。传递着思绪，愿生活甜蜜；中秋明月夜，清辉洒满天。送去祝福语，愿事业有成，财源广进！中秋愉快哦！,4
对月当歌，中秋几何？鼓瑟吹笙，共庆佳节。青青子衿，悠悠我心，但为君故，挂念至今。天遥地远，花好月圆。中秋愉快！,4
明月，一闪一闪，挂天边；思念，一丝一丝，连成线；祝愿，一点一点，汇成泉；幸运，一滴一滴，不曾减；联系，一季一季，不会闲；中秋，一年一年，盼团圆；愿你，一刻一刻，比蜜甜。中秋节快乐！,4
月影摇晃着欣喜，快乐洋溢着心底，花朵飘香着日子，月饼甜美着惦记，心愿徜徉着欢喜，祝福泛动着涟漪，心绪调剂着消息，只为送给你。中秋快乐！,4
中秋佳节明月圆，良辰佳节月饼甜，花好月圆祝福你：慢慢品尝我的祝福情，慢慢咀嚼我的祝福话，慢慢回味我的祝福语。中秋平安快乐！,4
一丝丝秋风，让我们感到秋凉；一缕缕月光，把我们友情照亮；一块块月饼，我们分开品尝；一个个心愿，一定要大声对你讲：中秋节快乐！,4
中秋将至，祝你日圆，月圆，梦圆，团团圆圆；官源，财源，路源，左右逢源；人缘，福缘，份缘，缘缘不断；情愿，心愿，意愿，愿愿随心。,"0,4"
圆圆的月儿天上挂，圆圆的月饼香天涯，圆圆的快乐美如花，圆圆的祝福到你家：美满日子玉润珠圆，幸福生活花好月圆，合家吉祥永团圆。节日快乐！,"0,2,4"
