让最圆的明月陪伴你和我，让明月传达我的心愿与祝福。祝你中秋佳节快乐，月圆人圆事事圆满,"0,1,2,3,4"
又是一年月圆夜，月下为你许三愿：一愿美梦好似月儿圆，二愿日子更比月饼甜，三愿心地犹如月光明。,"0,1,2,3,4"
中秋佳节不送礼，发条祝福祝福你，健康快乐长伴你，好运和你不分离！祝福你天天快乐。,"0,1,2,3,4"
以真诚为半径，用尊重为圆心，送您一个中秋圆圆的祝福愿：爱您的人更爱您，您爱的人更懂您！好事圆圆！好梦连连！预祝中秋快乐，月圆人更圆！,"0,1,2"
那一场风花雪月的事。中秋的月亮，在窗外静静地悬着。我楞楞地看着它，仿佛它是一面明镜，你我在互相注视。,3
中秋，思念的时节，我将真诚与祝福浓缩至祝福，带着关怀与思，随电波飞向你。,"0,1,2,3,4,6"
金秋圆月挂天边，浪子心中思念添；寂寞嫦娥空际舞，八戒被贬为那般；我予汝心天可表，千里也能共婵娟。,"0,1,2,3,4"
有月的夜晚，有你和我的夜晚，只想轻轻的向你道声，我的佳人祝你节日快乐！,3
月有阴情圆缺，人有悲欢离合。希望从今天起月亮永远是圆的，你永远是快乐的！祝你中秋节愉快！,"0,1,2,3,4"
在此中秋佳节来临之际，愿你心情如秋高气爽！笑脸如鲜花常开！愿望个个如愿！中秋快乐！,"0,1,2,3,4"
千里试问平安否？且把思念遥相寄。绵绵爱意与关怀，浓浓情意与祝福，中秋快乐！,"0,1,2,3,4,6"
八月十五中秋节，狮子吼来百鸟叫，狗熊大象欢乐跳，一起来把节日闹；只有小猪静悄悄，打开手机看祝福：猪你八月十五快乐！,"4,5"
春有百花秋望月，夏有凉风冬听雪，心中若无烦恼事，便是人生好时节，愿你晨有清逸暮有悠闲，梦随心动心随梦求，祝中秋节愉快！,"0,1,2,3,4"
八月十五月正圆，中秋佳节聚诸仙，东海龙王发来贺电，南海观音捎来请柬，西山王母带来吉言，北帝仙君送来祝愿。祝：中秋快乐！,"0,1,2,3,4"
中秋节，祝你的好运一帆风顺，事业顺理成章，工作顺心配合，生活一顺百顺，赚钱顺手牵羊，爱情得心应手，一切都对你顺顺利利！,"0,1,2,3,4"
你要是敢中秋节不快乐，我就把你的脸打成彩屏的，脑袋打成振动的，耳朵打成和弦的，全身打成直板的，你再郁闷就打成折叠的！,"4,5"
明月本无价，高山皆有情。人虽不至，心向往之。衷心祝愿您和家人团圆美满，幸福安康,"0,1,2"
相隔十万八千里，却沐浴在同一片月光下，迎接同一个节日，中秋，让月光送去我的祝福：团圆，快乐每一天,"0,1,2,3,4"
中秋月圆、佳节思亲、远隔天涯、举目有亲、心愿、祝愿、如愿、情缘、了愿。祝你幸福快乐,"0,1,2,3,4"
月饼圆圆的、甜甜的在这最美好的时刻祝您和您的家人合家欢乐、幸福美满,"0,1,2"
亲爱的，中秋节到了，我为你定做了一个月饼。主料：我爱你配料：思念。辅料：煎熬加寂寞少许生产日期：从见到你那天起保存日期：无限期标准号：1314,"3,5,6"
一轮明月思悠悠，两地月光似水流，三生有幸做朋友，四季轮回到中秋，五福临门来送喜，六六大顺伴永久，七星伴月人欢乐，八仙桌上敬美酒。预祝中秋快乐！,4
月露脸，玉兔跳，朗朗中秋快来到；嫦娥舞，后羿笑，吴刚帮拍婚纱照；天上欢，人间闹，吉祥如意好预兆；酒一端，乐淘淘，祝你阖家幸福步步高！,"0,1,2,3,4"
看着天上圆圆的月亮，想着远方美丽的你，虽然我很想你，但我不会寂寞，因为我与你在分享同一轮明月。,"3,6"
虽然千山将我们阻隔，万水让我们难聚，但想你的情难以舍,"3,6"
中秋将至，奉上一个月饼，配料：五克快乐枣，一把关心米，三钱友情水，用幽默扎捆，用手机送达保质期：农历八月十五前保存方法：请按保存键。,"4,5"
今夜明月圆，家家人团圆，幸福好因缘，快乐朋友缘，甜蜜爱情缘，愿你日日花好月圆，中秋更是幸福团圆,"0,1,2,3,4"
秋意撩人，皓月当空，思意正浓，一条祝福，虽然传递出了我的思念之情，却阻隔了我们团聚的笑脸，我的亲人，虽然不能团圆，依然要中秋节快乐！,1
倾国倾城钟秋洁，带着快乐把你追有情有义钟秋月，揣着好运把你陪可亲可爱钟秋桂，牵着成功共你醉。中秋到愿你乐逍遥。,"0,1,2,3,4"
又是一年月圆夜，月下为你许三愿：一愿美梦好似月儿圆，二愿日子更比月饼甜，三愿美貌犹如月中仙。,"0,1,2,3,4"
天上月圆，人间团圆，家庭情圆，朋友事圆，心中梦圆，左右逢圆愿你每一天中，人缘，情缘，福缘，财源，缘缘不断，事事如愿祝中秋节快乐,"0,1,2,3,4"
云彩变淡了，枫叶变红了，清风变凉了，桂花变香了，月亮变圆了，月饼变甜了，思念变浓了，距离变近了，中秋愿你生活越变越美，心情越变越好,"0,1,2,3,4"
皎皎天上月，圆圆中秋节。脉脉星河稀，款款逢佳期。个个月饼香，片片桂花芳。依依思念至，遥遥祝福句：甜甜日子美，浓浓幸福随。中秋快乐！,"0,1,2,3,4"
如果有一天，你走得太倦，只要一转身，我就在你身边！不管离多远，不管多少年！愿我的祝福化为繁星点点，闪在你生命的每一天！中秋快乐！,"0,1,2,3,4"
心到，想到，得到，看到，闻到，吃到，福到，运到，财到，中秋节还没到，但愿我的祝福第一个到，提前祝你中秋节快乐天天好心情,"0,1,2,3,4"
中秋快到了，有人祝福搞笑，有人祝福整蛊有人祝福传情，有人祝福祝福我没有那么多花样，只有送上一句轻松的问候：预祝中秋快乐,"0,1,2,3,4"
烦恼随风，刮向天空，快乐成风，迎面吹送。道顺，人顺，事事顺，你好，我好，大家好。中秋快乐。,"0,1,2,3,4"
相隔十万八千里，却沐浴在同一片月光下，迎接同一个节日，中秋，让月光送去我的祝福：团圆，快乐每一天,"0,1,2,3,4"
星星的寂寞月知道，晚霞的羞涩云知道，花儿的芬芳蝶知道，青草的温柔风知道，梦里的缠绵心知道，心里的酸楚泪知道，我的思念您知道我的祝福请记牢：祝中秋节快乐,"0,1,2,6"
八月十五中秋节，动物森林也疯狂狮子吼来百鸟叫，狗熊大象瞎胡闹，一起来把节日闹只有小猪静悄悄，打开手机看祝福：猪你中秋节快乐,"4,5"
月满人齐全，家国两团圆，花好月圆佳节夜，思念千里梦甜甜。祝福你中秋佳节快乐，合家团聚，月圆人更圆。,"0,1,2,3,4"
我将你的手机号码告诉了一个陌生人，他叫月老，他会在中秋月圆夜要帮我告诉你我心思你，我心念你，我心祝你中秋快乐,"3,6"
中秋的月亮，在窗外静静地悬着。我楞楞地看着它，仿佛它是一面明镜，你我在互相注视，互致绵绵思意和祝福：心上人中秋快乐,"3,6"
偶尔的繁忙，不代表遗忘，秋天的到来，愿你心情舒畅，曾落下的问候，这次一起补偿，所有的关心，凝聚这条祝福：祝福你朋友。,4
再胖的人也有权利去增肥。苗条背后其实是憔悴，爱你的人不会在意你的腰围。尝尝阔别已久月饼的滋味。中秋节撑死也是一种美！,"3,4,5"
中秋的月亮，在窗外静静地悬着。我楞楞地看着它，仿佛它是一面明镜，你我在互相注视，互致绵绵思意和祝福：心上人中秋快乐！,"3,6"
中秋送去美好祝愿，愿你的快乐天天兑现，幸福天天相伴，好运天天不断，身体天天康健，爱情一生一世圆满，中秋节快乐无极限！,"0,1,2,3,4"
茕茕玉兔，东走西顾。衣不如新，人不如故。佳节祝福，费您莫属。爱情甜蜜，家庭和睦。事业折桂，升迁如兔。老朋友，中秋节快乐！,4
中秋佳节月儿圆，圆出全家聚一堂桂花散香飘祥瑞，嫦娥送福美万年愿你福圆满家园花好月圆人团圆事业顺利步步高，阖家幸福永平安。祝你中秋节快乐,"0,1,2,3,4"
清风送去了我的祝福，明月带来了我的问候，流星记载了往日的故事，玉兔留下了永恒的吉祥。祝你中秋佳节快乐，月圆人圆事事圆满,"0,1,2,3,4"
八月中秋月儿圆，对着嫦娥表思念，心中的人啊你可看见，嫦娥也在默默祝愿，愿你生活比蜜甜,"0,1,2,3,4"
今年中秋节不送礼，发条祝福祝福你，健康快乐唱伴你，好运和你不分离，还有让我告诉你，财神已经跟随你，钞票珠宝都给你，幸福人生属于你中秋假日快乐,"0,1,2,3,4"
月儿圆圆挂天边，荷叶圆圆水中间。梦想圆圆都实现，成功圆圆舞翩跹。快乐圆圆永不变，祝福圆圆情无限：中秋花好月又圆，幸福与你两团圆。,"0,1,2,3,4"
中秋快乐如果有什么值得庆祝的话，那一定是团圆如果有什么值得庆幸的话，那就是平安。,"0,1,2,3,4"
月缺时我想你，月圆时我念你，无论月圆月缺，我的心如那恒古不变的月光默默的追随着你的每一次微笑,"3,6"
忙吗只是想用这种不打扰你的方式告诉你，今天是中秋节，我在想你，你呢记得要把你的爱也传递出去哦，让爱你的人，感受到你的情谊啊,4
你好，我是财急送的送货员，钟秋洁给你寄了包裹，请验收：一辈子的平安与幸福，甜蜜的爱情与好心情，永远垂青你的好运气。,"0,1,2,3,4,5"
月升是我的牵挂，月落是我的关怀，月盈是我的惦记，月亏是我的思念，月芽是我的真诚，月弯是我的微笑，月圆是我深深的祝福。中秋节快乐！,"0,1,2,3,4"
古色楼，黄河水，今宵明月天下美。紫金壶，白玉杯，盛来秋月万里辉。月饼甜，桂花香，阵阵清风绕回廊。人团聚，永相协，中秋节快乐！,"0,1,2,3,4"
亲爱的朋友，又逢佳节中秋，皓月当空，圆润丰盈，愿你幸福安康，合家团圆，品饼赏月，共享天伦之乐，祝中秋快乐、甜蜜幸福！,"0,1,2,3,4"
恨君不是江楼月，东西南北，东西南北，只愿相随不愿离；恨君恰似江楼月，暂满还亏，暂满还亏，待得团圆是几时？,"3,6"
好累啊，我和太阳打了一天的架，想夺个月亮送给你，没想到那家伙不给我面子，我一气之下给踩成了月饼，不介意就收下吧，提前祝你中秋节快乐！,"4,5"
又是一年落叶黄，一层秋雨一层凉。整日工作挺辛苦，天凉别忘加衣裳。保重身体多餐饭，珍惜友情常想想。信短情长言未尽，唯愿朋友多安康。中秋快乐，合家团圆,4
圆圆的月儿天上挂，圆圆的月饼香天涯，圆圆的快乐美如花，圆圆的祝福到你家：美满日子玉润珠圆，幸福生活花好月圆，合家吉祥永团圆。,"0,1,2,3,4"
以真诚为半径，用尊重为圆心，送您一个中秋圆圆的祝福祝愿：爱您的人更爱您，您爱的人更懂您好事圆圆好梦连连祝中秋快乐，月圆人更圆,"0,1,2"
让最圆的明月陪伴你和我，让明月传达我的心愿与祝福。祝你中秋佳节快乐，月圆人圆事事圆满,"0,1,2,3,4"
草儿箐箐，花儿幽幽，月儿圆圆，梦儿绵绵，心儿甜甜此刻情飞千里明月寄相思中秋节,"0,1,2,3,4,6"
你问我爱你有多深，月亮代表我的心，你问我想你有多少，月饼代表我的爱，你问我回家不回家。哈哈，今天中秋，我要回家看我妈。,1
水盼团圆汇聚成海，石盼团圆高耸成山，月盼团圆辉映人间。水说海枯心不变，石说山崩情依恋，月说寄情我承担，我说中秋盼团圆预祝中秋快乐,"0,1,2,3,4"
趁着时间尚早，心儿尚未凌乱，夜色还未上演，月亮还不很圆，月饼还未端出，祝福尚未拥堵，我赶在中秋到来之前，送你祝福，共享喜悦。,"0,1,2,3,4"
中秋节至，为你送上一轮多功能圆月，助你把烦恼穿“月”,"0,1,2,3,4,5"
佳节送福，非你莫属。爱情甜蜜，家庭和睦。事业折桂，升迁如兔。老朋友，新祝福，祝你中秋佳节喜在心头住,4
花好月圆日，中秋喜相逢明月寓团圆，祝福寄友朋：愿生活如圆月，梦想皆达成，幸福明月光，伴你天下行中秋快乐,4
你是月饼我是馅，缠缠绵绵总见面你是风筝我是线，追追逐逐把你牵你是明月我是泉，圆圆满满一万年,3
想念你的微笑，回味你的味道，脱掉你的外套，露出你的美妙，控制我的心跳，压抑我的狂燥，想想我的需要，还是把你干掉啊月饼中秋快乐,5
思念如绿叶，渐渐舒展，又是中秋月圆夜，与月亮星星相望醉眼，想你的心化作梦呓，祝福你,"3,6"
亲爱的：不要悲伤，我们虽远隔千山万水。只要我们相互牵恋，思念我们同样可以共享明月,"3,6"
喜事精神爽，人团家圆事业成。节日愉快身体硬，心想事成您准赢。,"0,1,2"
月到中秋，分外想你。看到那空中圆圆的月亮吗那就是我想你念你牵挂你的心爱你吻你晚安,"3,6"
月儿圆圆天边挂，梦想圆圆都成真，荷叶圆圆水中立，情谊缘缘永不变。祝福源源祝福传：中秋花好月又圆，幸福快乐两团圆。祝你中秋快乐,"0,1,2,3,4"
八月十五相思夜，坐着相思椅，望着相思月，相思夜里话相思，句句相思语浓浓相思意，手握相思笔，写下相思句，倾尽柔情相思你：祝你中秋快乐,"0,1,2,3,4,6"
月升代表我的牵挂，月落代表我的关怀，月盈代表我的惦记，月亏代表我的思念，月芽代表我的真诚，月弯代表我的微笑，月圆代表我的祝福。中秋节快乐,"0,1,2,3,4"
左手握住健康，右手抓住财富。左腿跨过艰难险阻，右腿踏上成功之路。用力喊出幸福，用心感受我这中秋祝福：中秋快乐,"0,1,2,3,4"
不必多说，将真情融进字句里；不必牵挂，这月儿照着我也照着你；不需微风，黄叶也会写下美丽的寄语；不需祝福，中秋前夕，知道你一定也快乐惬意！,"0,1,2,3,4"
又是一年落叶黄，一层秋雨一层凉。整日工作挺辛苦，天凉别忘加衣裳。保重身体多餐饭，珍惜友情常想想。信短情长言未尽，唯愿朋友多安康。中秋快乐，合家团圆,4
我的问候来自心间，多想帮你驱散这连绵的阴天，让火红的太阳露着笑脸；我的祝福是对你诚恳的关怀，希望你在这个金色的秋色里，注意身体，健康平安！中秋节快乐。,"0,1,2,3,4"
把酝酿已久的创意交给秋风，任其去演绎相思的旋律；让企盼团聚的心跃上太空，在月宫桂树下再续永恒的主题。中秋佳节来临之际，愿你心情如秋高气爽，笑脸如鲜花常开！,"0,1,2,3,4"
趁着心儿尚未凌乱，夜色还未上演，月亮还不很圆，月饼还未端出，祝福尚未拥堵，我赶在中秋到来之前送你祝福，祝你中秋佳节人团圆、欢乐满、幸福绵延！,"0,1,2,3,4"
又是一年落叶黄，一层秋雨一层凉。整日工作挺辛苦，天凉别忘加衣裳。保重身体多餐饭，珍惜友情常想想。信短情长言未尽，唯愿朋友多安康。中秋快乐，合家团圆！,4
嫦娥当空舞，玉兔合金乌。丰收秋色满，万家团圆度。花好月圆时，祝福送祝福。家有合欢树，健康又幸福。诸事都圆满，好运常光顾。祝中秋节快乐！,"0,1,2,3,4"
月是中秋分外明，我以明月寄钟情，你是明月照我心，我作星星永相亲，祝身心健康。天天快乐。,"0,1,2,3,4"
月华如霜，浸入你的心房；微风送爽，吹去你的忧伤；星光拂窗，照亮你的方向；白云流芳，祝福送你身旁。中秋愉快！,"0,1,2,3,4"
丹桂要笑，香气缭绕；金菊要笑，倩影摇摇；圆月要笑，中秋欲临，佳节要到。我也要笑，提前准备，祝福早到：愿你情圆事圆人团圆，吉祥如意享美好！,"0,1,2,3,4"
好久不见，中秋节祝福捎给你关怀：愿你时时刻刻有快乐相伴，分分秒秒与好运缠绵，日日夜夜与安康拥抱，年年岁岁有幸福相随。愿你微笑绽放，喜乐连连！,"0,1,2,3,4"
不管你此时身在何方，抬起头看看那被你遗忘很久的月亮，因为它满载我的思念和祝福亲爱的朋友，祝愿你中秋节快乐，幸福美满！,4
爱人要选温柔似水甜如蜜的；对手要选聪明能干强有力的；同事要选埋头苦干没脾气的，朋友要选猪头狗脑流鼻涕的，别看了，快把鼻涕擦了，中秋节快乐！,4
非常荣幸邀请你及家人出席中秋夜宴，菜单如下红烧快乐，火爆开心，油炸浪漫，清蒸健康，水煮团圆，干煸四季欢乐豆，本店利薄，谢绝自带月饼！,"0,1,2,3,4,5"
吃着月饼思念你，赏着圆月牵挂你，发条祝福问候你，中秋到了，祝你牵着爱人，伴着家人，吃着月饼，赏着圆月，团团圆圆，幸福一生！,"0,1,2,3,4,6"
我用心做两个月饼，一个送给你、祝愿你节日快乐、事事如意、青春美丽，一个送给自己，祝福我认识了你。中秋节祝福祝福,"3,4"
采一轮松间明月供你观赏，织一件秋日的凉爽为你披上，斟一杯月宫的琼浆醉你心上，做一份仲秋的祝福圆你梦乡。,"3,4"
朋友，不管你现在身处何方，今晚一定要看看那被你遗忘已久的月亮，许个愿吧，很可能就会实现哦!中秋快乐!,4
从弯月到半圆，从半圆到满月，从月盈到月亏，从月升到月落，我盼呀盼呀，八月十五都过完啦，你还没请我吃月饼。作为惩罚，我决定把吃剩的给你留下！,"4,5"
把酝酿已久的创意交给秋风，任其去演绎相思的旋律；让企盼团聚的心跃上太空，在月宫桂树下再续永恒的主题。中秋佳节来临之际，愿你心情如秋高气爽，笑脸如鲜花常开！,"0,2,4"
春夏秋冬四季天，人生几时得空闲；月到中秋亮又圆，放松自己许个愿；幸福生活多美梦，愿你美梦总香甜；半醉半醒似神仙，开开心心每一天！,4
错过了太阳的辉煌，还有月亮的静谧。错过了流星的花园，还有月色的荷塘。错过了七夕的浪漫，还有中秋的团圆。人生不一定圆满，与你举杯邀月就无憾！,4
亲爱的朋友，最近在忙什么？茫茫人海，漫漫人生中，过程是最美的，相知是最难的，结果是最期盼的，相思是最苦的，等待是最漫长的，中秋祝福是最珍贵的。,4
四季交替有了金秋的美丽，岁月流转有了想你的心情，祝福传递有了问候的美丽，中秋来临有了真诚的祝福：愿你人生梦想圆，合家团聚笑开颜。,"0,2,4"
八月金秋桂送香，十五明月情溢边。丹桂香郁是千里，明月寄情是惬意。一缕香入魂，乐在此中行，为你行，为我行，快乐随行。为你行，为我行，祝福行！,"0,4"
趁着时间还不是很急，心儿还不是很乱，夜色还不是很浓，月亮还不是很圆，我要迫不及待地送出一份祝福，赶在中秋到来之前，与你共同分享一份喜悦！,4
丹桂要笑，香气缭绕；金菊要笑，倩影摇摇；圆月要笑，中秋欲临，佳节要到。我也要笑，提前准备，祝福早到：愿你情圆事圆人团圆，吉祥如意享美好！,"0,2,4"
江山易变，情字难改，春去秋来，花谢花开伴随着微寒料峭的秋风，佳节中秋即将到来，放不开思念你的情怀，节日里祝你扫掉阴霾，舒心畅快。,"4,6"
非常荣幸邀请你及家人出席中秋夜宴，菜单如下：红烧快乐，火爆开心，油炸浪漫，清蒸健康，水煮团圆，干煸四季欢乐豆，烘烤友情黑面包，谢拒自带月饼！,"4,5"
一壶桂花酒，送给好朋友。两碟月饼香，绵绵情意长。三生实有幸，愿你烦恼尽。四季月常圆，快乐又悠闲。五福又临门，愿你倍精神。六六事业顺，成功把你随。七喜人陶醉，幸福把你围。中秋节快乐！,4
天上有个月，水中有个月，我这儿也有个月。为送礼现将月饼放在水中，用月光返照原理速递过来。祝中秋节快乐，月圆人更圆,"4,5"
发出的是文字，收到的是快乐，见到的是文字，不见的是牵挂，打开的是健康，读出的是吉祥，默默的是祝福。祝中秋节快乐。,"3,4,6"
明月几时有，把饼问青天，不知饼中何馅，今日是莲蓉，我欲乘舟观月，又恐飞船太慢，远处不胜寒。,5
一个月亮一个你，二个影子我和你，三生有幸认识你，四个月来好想你，五湖四海寻找你，六神无主迷恋你，七星伴月围绕你，八月十五我等你。,"3,6"
一百个人对中秋会有一百个理解，一百个人对团圆会有一百个向往，一百个人对圆满会有一百个憧憬，我对你的关怀和思念永远都只有一种，那就是：我希望你过的好！,"3,4"
愿问候是月光，柔柔照进你梦乡；愿关怀是枫叶，轻轻飘散出快乐芬芳；愿祝福是小溪，悄悄流淌你心上。中秋快乐！,"0,2,4"
孩子只愿假期有零食有快乐招着小手；老人只愿健康久福气久儿女事事都有，父母只愿工资有工作久幸福天长地久。亲爱的朋友，9月9，等中秋，团圆马上有，假期乐悠悠！在中秋来临之际，愿你保持快乐！,4
秋风清，秋月明，祝你天天好心情；桂花香，皓月亮，愿你事事都顺畅；笙歌响，糕饼香，送你如意加吉祥；中秋节祝你合家欢乐、幸福如意。,"0,2,4"
送你一缕清风，愿它带给你清爽心情，送你一朵白云，愿它带给你连绵好运。送你一个月亮，愿它代我祝福你：中秋快乐！,"3,4"
浪漫中秋，明月含羞，想你切切何解忧？祝福一首，字字真情，月明星稀终守候。千里思念遥相寄，绵绵爱意于此诉，浓浓情意化祝福：中秋快乐！,"1,3,6"
涵虚云雾分，人向广寒奔。蟾宫折桂日，岂敢笑王孙。中秋共晴光，美景伴良辰。药经灵兔捣，玉液满金樽。举杯同祝愿，月圆永无痕。,4
桂花香，菊花黄，月儿挂在头中央，我来为你祝福忙，愿您身体强壮似吴刚，事业好比明月光，生活更像月饼圆，一年更比一年强。祝您中秋节愉快。,"0,1,2"
秋日灿烂，大雁南成行；秋山尽染，菊黄丹桂香。秋实累累，果熟花芬芳；秋月朦胧，欢声笑语长。月圆饼亦香，酒浓情也长。佳节思故乡，天涯比邻强。花好月圆时，真情莫相忘。预祝中秋节幸福吉祥！,"0,4"
虽然我是宅女，但我有内涵；小女一人在家，好孤单！记得我俩曾经有缘，只怪当时你粗鲁了点。今我再也不嫌你丑了，中秋节，猪哥哥，开心点，有空来玩！,"3,5"
取快乐无忧之泉，和健康平安之面，捏花好月圆之皮，包甜蜜幸福之馅。用关怀体贴之火烘烤，以思念祝福之信传递，送上特制月饼，祝中秋快乐！,"0,1,2,4"
我和你一年一见，感情日益缠绵。你摸着我温热的身体，崩溃我的心理防线。任你轻吻，直至我走进你的心里面。我是月饼，记得吃我时别狼吞虎咽！中秋快乐,3
由本人自导自演，斥资上亿真情，精心打造的限量版超级巨片《中秋祝福》，将在八月十五隆重首映！届时我的真情将全裸出镜，毫无保留！台词：中秋快乐！,5
夏日的最后一抹热浪，慢慢消逝在流去的时光，中秋佳节，带来了金秋的清凉，在这收获的时节，真诚愿您收获一份幸福，收获一份成功！中秋快乐！,"0,3,4"
八月桂花香，愿生活别累多点芬芳，中秋月如水，愿工作顺心日子更美，嫦娥住蟾宫，愿爱情甜蜜财源兴隆，中秋祝福到，愿前途无量处处看好，中秋快乐。,0
送您一块桂花糕，愿您事业步步高；送您一碗桂花酿，愿您前途顺又畅；送您一盏桂花酒，愿您健康福长久；送您一缕桂花香，愿您中秋佳节合家笑哈哈。,"0,1,2"
中秋快乐莫等待，请你来把字谜猜。才子成功离开财，凭口一张地位来，画个框框里面待，幸福美满笑开怀。不妨望月将头抬，答案自然心中来。祝中秋快乐！,"0,4"
给你阳光暖你心，送你奔驰显你尊，给你美酒醉芳唇，送你浪漫到如今，幸福淹没你，好运陪伴你，可我不做上帝很久了，只能用祝福祝福你：中秋快乐！,3
月儿高高，思念心情给你捎，开口笑笑，好彩好运一起到，心儿跳跳，迎得福气来拥抱，日子好好，幸福生活抱你腰，中秋佳节，祝愿工作事业步步高。,"0,2,4"
桂花的清香，在空气中弥漫着甜蜜；满山的红叶，在晚风中飘扬着美丽；今宵的明月，在夜空中印刻着记忆。中秋佳节，真诚祝愿您万事如意！,"0,1,2"
天上月儿明，皎皎光华照夜影，照亮您广阔前途的坚定；祝福似星星，一闪一闪亮晶晶，闪着我诚挚不变的真心。中秋佳节，愿您成功路上不留停。,0
玉宇无尘，银河泻影，月色横空，花荫满径，中秋的夜晚格外温馨，空气弥漫着甜蜜，光华浸透着祝福，中秋佳节，真诚祝愿您合家团圆，前途顺利！,"0,2"
