月儿高照耀吉祥，月满人圆日子甜。月圆家圆共团圆，月饼甜美齐乐融。齐围圆桌品秋果，挥杯敬酒庆中秋。欢声笑语家和美，如意安康幸福伴。祝你中秋家圆万事兴！,"0,1,2,3,4"
春有百花，秋望月！夏有凉风，冬听雪！心中若无烦恼事，便是人生好时节，愿你晨有清逸暮有悠闲，梦随心动心随梦求，祝中秋节愉快！,"0,1,2,3,4"
别拿月饼不当干粮，咬一口富贵吉祥；别拿月亮不当美景，赏一眼金玉满堂；别拿祝福不当回事，读一读情谊绵长；中秋佳节到，祝您合家团圆，幸福万年长！,"0,1,2"
不知不觉又一个中秋佳节来临，祝您心里想着月饼，口里吃着月饼，脸儿乐得像月饼，甜甜蜜蜜赛月饼，愿我们的祝福伴着您渡过一个快乐的中秋节！,"0,1,2"
中秋将至，我托月亮带去我的问候，托月光带给你吉祥，托月色给你带个话‘中秋快乐，愿我们的合作更加圆满’！,0
中秋佳节倍添喜，锣鼓喧天问候你，烟花绚烂照亮你，月饼香香迷住你，明月温柔爱给你，福福无限缠着你，惊喜连连笑纳你。中秋节快乐！,"0,1,2,3,4"
佳节倍思亲，圆圆是我心；明月本无价，高山皆有情；花好人团聚，祝福伴你行。愿你的生活就像这十五的月亮一样，圆圆满满！中秋节快乐！,"0,1,2,3,4"
中秋节月圆是画，月缺是诗。如诗如画，良辰美景，送给我心爱的你。遥远的星空下，共同仰望同样的美月，是你我心灵的契约！,3
一轮明月，两地相隔，真情频传话语切。悠悠东风吹半缕，聚欢离恨长相忆。昔日月满在西，而今融情祝福中，可曾记否，雁字回时，两情相悦，共享中秋。,"3,6"
明月几时有，把饼问青天，不知饼中馅，竟然比蜜甜，我欲飞去看你，又恐技术不够，高处有危险，只好用祝福，寄出我祝愿中秋快乐团圆。,"3,5,6"
中秋就到，送你“双黄”月饼，愿你工作、生活双辉煌；送你“莲蓉”月饼，愿你好运连连多笑容；送你“五仁”月饼，愿你五福临门人欢乐。预祝中秋快乐！,"0,1,2,3,4"
最近老是心律失常，半夜醒来汗流如浆，没事就去翻翻日历，心里紧张得早已变样。谁想跟我抢占中秋祝福的沙发？哼，想都别想！预祝中秋快乐，喜气洋洋！,"0,1,2,3,4,5"
今日望月我画了个圆，有人说是明月圆，有人说是月饼圆，还有人说是人团圆，他们都不具慧眼，此乃神秘礼物，隔空送给你的“傻蛋”！哈哈，傻蛋快乐哟！,"4,5"
中秋佳节，花好月圆，美景常在，幸福久远，祝福传真情，祝福保平安，祝你身体健康，合家团圆，事业红火，生活美满。中秋快乐，愿我们合作长远。,0
尊敬的客户您好：借着中秋的吉祥，愿您吉祥如意，伴着月亮的圆满，愿您家庭美满，和着月色的金光，愿你事业辉煌，带着月饼的香甜，愿您生活比蜜甜，祝‘中秋快乐’。,0
中秋节要到，祝福该送了，你有才气有相貌，热情热心脾气好，在我心中地位高，想来想去，美好祝愿先送你最好：预祝你事圆情圆人团圆，中秋佳节乐逍遥！,"0,4"
时光在流转，月缺终得圆。踏着月色的浪漫，嗅着桂花的香远，互致真诚的祝愿，牵手永恒的誓言，碰杯欢聚的瞬间。祝你中秋快乐，幸福到永远！,3
很想你，可又不好意思打给你，怕你觉得我老骚扰你，真的好想和你联络，但是猪是不会和我聊天的，只会傻傻的看我发的祝福猪你中秋快乐！,"3,4,6"
月饼代表我的情，月亮代表我的心，送你月饼，让你明白我的真情，陪你赏月，让你明白我的心意，中秋佳节，祝你阖家团圆，快快乐乐！,"0,1,2,3,4"
一轮圆月寄托着万千思念之情，一块月饼凝聚着融融的团圆气息，浓浓桂花散发着不变的牵挂芬芳，一条祝福传递了温馨的祝福绵绵。愿你中秋快乐。,"0,1,2,3,4"
送你一轮圆圆的月，思念为圆心，关怀长围绕；送你一个圆圆的饼，幸福为圆心，好运长环绕；送你一句圆圆的祝福，真诚为圆心，友情长围绕。中秋快乐！,"0,4"
一轮圆月挂中天，满屋喜庆享团圆，几许温情绕杯盏，满腹知心托婵娟，但愿人长久，月圆心相牵。中秋佳节，祝福合家美满，万事如意。,"0,1,2,3,4"
中秋在眼前，思念碧波潋，好友心相连，祝福提前传：美梦如月圆，事事随心愿；生活似月饼，甜蜜润心田；快乐恰月桂，香飘脑海间。预祝中秋快乐！,"4,6"
圆圆月亮挂天边，幸福喜悦挂脸边，月饼放到嘴里边，甜蜜快乐放心边，中秋祝福祝福编，愿你幸福乐无边，如意美满绕身边。中秋节愿你合家欢乐，好运连篇。,"0,1,2,3,4"
愿风带给你轻柔的思念，愿云托给你心中甜蜜的祝福，送一个圆圆的饼，献一颗圆圆的心，寄一份圆圆的情，一个圆圆的梦。中秋节快乐！,"0,1,2,3,4,6"
你的手机从今日起已具备买月饼功能，预订请拔，送货请拔，如有疑问请与本中心联系，网址三达不溜点爱坑你就坑你点坑么！中秋快乐！,"1,3,4,5"
中秋将至，奉上一个月饼，配料五克快乐枣，一把关心米，三钱友情水，用幽默扎捆，用手机送达；保质期农历八月十五前；保存方法请按保存键。,"0,4,5"
长长的距离连着长长的线，长长的线儿连着长长的思念，长长的思念连着长长的岁月，长长的岁月连着对你的惦念。中秋佳节，花好月圆，祝你开心无限！,"0,1,2,3,4,6"
中秋节到，我在嫦娥那里求到一条祝福，本祝福不简单，可以保佑你和你的家人一生健康，一世平安，一辈子幸福，我现在发给你，请保存好。祝中秋快乐！,"0,2,3,4"
送你一盒特制月饼，用关怀和面，擀思念为皮，以真情为馅，再以祝福打包送上，打开手机就可接收！虚拟的世界，只能画饼充饥，唯此情不虚也！,"0,1,2,3,4"
去年月圆时，花灯亮如昼；月上柳梢头，人约黄昏后。今年圆月时，月与灯依旧；不见去年影，祝福忙不停。收到祝福请回复，别让我相思过度。中秋快乐！,"3,4,6"
一步步走过，那支持的步伐，一声声闻过，那肯定的赞扬，一页页翻过，那合作的经历，你的信任和支持，是我们伟大的后盾，中秋佳节，借真情祝福，对您表示真诚感谢，愿你身体健康，万事如意。,0
有三个好消息要告诉你，一是中秋节就要到了，我提前祝你节日快乐；二是中秋节的月亮又亮又圆，可以免费欣赏；三是你如果送我礼物，我一定不会拒绝。,"4,5"
中秋来临，送上秘制月饼，快乐做皮，幸福做馅，传说只要吃下去的人将会得到神的眷顾，永远开心和幸福，所以我将它送你，因为我希望你开心、幸福！,"0,1,2,3,4"
尊敬的客户：中秋将至，特为您量身订做了吉祥祝福，本祝福仅限于您个人使用，请一定要收好，您将会伴随祝福收到幸福，收取快乐，收获成功。祝‘中秋快乐！’,0
中秋佳节。《十五的月亮》最圆最美，不《一样的月光》，不一样的《祝福》，俺公司代言人“嫦娥仙子”亲自祝福你，尊敬的“客户上帝”：生活幸福、甜甜蜜蜜《花好月圆》《万事如意》！,0
送块月饼给你，因为好吃，我做的。中秋了，月圆了，是祝福的时候了，愿你永远幸福，没有烦恼，永远快乐，天使没有你纯洁，花儿没有你灿烂。,"0,1,2,3,4"
一别之后，两地相思，只说是三四天，有谁知五六月？七夕相聚太遥远，八月半月圆人盼圆，九重登高把你念，十里长街望穿秋水！祝中秋快乐！,"3,6"
一肩明月天上悬，二分明月洒窗前，一日三月盼相见，五黄六月心如煎，七星捧月喜连连，八月十五庆团圆，九天揽月你最眩！中秋节快乐！,"3,6"
丰收这幸福做陷，聚集这快乐做皮，取这天上的月亮为模型，为你做这世界上最为圆满的月饼，希望你中秋佳节人月两团圆，中秋节快乐。,"0,1,2,3,4"
中秋本是团圆日，却有异客他乡行，千里婵娟寄相思，点点星光照真情，祝福送福提前至，细语牵挂暖游子，幸福天涯共此时，愿你快乐永不止！,"0,1,2,3,4"
景是中秋美，月是故乡明！把酒庆佳节，合家笑盈盈！年年花相似，岁岁人更兴！三言又两语，字字总关情！问候传喜讯，中秋节快乐！,"0,1,2,3,4"
中秋佳节月儿满，从“”到“”寓团圆；表情从“：”变成“：”，人人欣喜笑颜绽；双眸由“。”变到“”，一扫疲惫快乐添！祝快乐！,9
尊敬的客户：中秋将至，特为您量身订做了吉祥祝福，本祝福仅限于您个人使用，请一定要收好，您将会伴随祝福收到幸福，收取快乐，收获成功。祝‘中秋快乐！’,0
许一个心愿，祝你快乐平安；送一份真情，愿你吉祥如意；发一条祝福，告你中秋来临；写一段文字，我们彼此珍藏。中秋佳节，共享团圆。,"0,1,2,3,4"
中秋佳节月圆夜，月下为你发祝愿：一愿你美梦如月圆，二愿你生活更比月饼甜，三愿你事业花开比秋菊艳，四愿你姻缘美满家庭幸福赛神仙！,"0,2,4"
中秋月儿圆又圆，买卖双方笑开颜，为谢客户久眷恋，特发祝福送福缘，一祝全家齐团圆，二祝祥和乐满园，三祝财运滚滚来，四祝身体强又健，五祝事业更向前！中秋快乐，欢迎您常回来看看！,0
千好万好事事好，月圆情圆人团圆。圆月年年相似，你我岁岁相盼。花好月圆人团聚，祝福声声伴你行。朋友：中秋快乐！,"0,4"
你的一笑，使人心跳；你的一看，世界震撼；你的一站，交通瘫痪；你一出汗，海水泛滥；你不打扮，已很好看；你一打扮，宇宙惊叹美女，给你祝愿：中秋快乐！,"3,4,5"
亲，我正着手筹备公司生产的月饼哦。用浪漫做皮哦；用温馨做馅哦；幸福做蛋王哦；懂得品味的人不需要多，最好只有你一个哦！,"3,4"
丰收这幸福做陷，聚集这快乐做皮，取这天上的月亮为模型，为你做这世界上最为圆满的月饼，希望你中秋佳节人月两团圆，中秋节快乐。,"0,1,2,3,4"
中秋送你一堆“秋”，开心快乐乐悠悠：吉祥如意各有千“秋”，成功顺利万代千“秋”，幸福生活岁岁春“秋”，永远没有多事之“秋”。中秋快乐！,"0,1,2,3,4"
明月寄相思，浓浓思乡愁，家家盼团圆，游子望月把泪流，共吃一块月饼，高举一壶酒，中秋佳节祝福家家团圆，祖国早日统一。,政治
瓜子仁核桃酥，中秋祝福送给“猪”。花生饼苹果派，“猪”你青春会常在。枣子生梨红葡萄，“猪”你过的乐逍遥。“猪”，中秋快乐！,"3,4,5"
中秋将至，十分钱的祝福太小气，我送你五元的一是月圆不花钱，二是人圆没时限，三是梦圆万事顺，四是情缘比蜜甜，五是圆了你心愿健康开心到永远！,"0,1,2,3,4,5"
中秋季又到了，送黄金太贵，送月饼又太累，想来想去还是送条祝福既实惠又珍贵。感谢您的通力合作，祝愿您中秋快乐，合家团圆。,0
中秋到，问个好，祝您事业滔滔福心照；月饼甜，月儿圆，祝您好梦连连家美满。在这美好的日子里，希望月光带去我们全体员工对贵公司的祝福，愿你们人圆梦圆事业圆，家圆运圆事事圆！,0
玉宇无尘，银河泻影，月色横空，花荫满径，中秋的夜晚格外温馨，空气弥漫着甜蜜，光华浸透着祝福，中秋佳节，真诚祝愿您合家团圆，前途顺利！,"0,2"
月圆月明月映天，月光月景月下观，月落月起月轮回，月隐月现月妩媚，月冷月寒月陪伴，月缺月残月在天，月到中秋月更圆，合家团圆赏月艳，祝中秋快乐！,"0,1,2,3,4"
嫦娥舞，玉兔跳，中秋佳节到；明月照，桂花俏，快乐把你抱；好运来，健康绕，幸福来报道；朋友情，祝福到，愿你日子美得呱呱叫。朋友，中秋快乐！,4
分分喜悦无忧，刻刻高兴欢喜，时时活泼开朗，日日蒸蒸日上，月月事事顺心，年年吉祥如意！金秋佳节，祝您人圆家圆，业顺事兴！,"0,1,2"
圆圆的月儿诉相思，甜甜的月饼裹幸福，浓浓的美酒郁喜庆，条条的祝福送祝福，中秋佳节，愿你合家欢乐，幸福美满，中秋愉快！,"0,1,2,3,4,6"
一轮圆月寄托着万千思念之情，一块月饼凝聚着融融的团圆气息，浓浓桂花散发着不变的牵挂芬芳，一条祝福传递了温馨的祝福绵绵。愿你中秋快乐。,"0,1,2,3,4,6"
月到中秋分外妖娆，节日祝福我要先到；亲爱的客户，感谢一路的合作，借明月送我衷心的祝福给您，祝人逢佳节精神爽，人团家圆事业成，身体健康，快乐每一天！,0
月亮是诗，繁星是画，愿所有的幸福伴随你，问候是春，关心是夏，愿所有的朋友真心待你，温柔是秋，浪漫是冬，愿所有快乐跟随你。祝中秋节快乐！,"0,1,2,3,4"
月圆圆月团圆夜，团圆夜里望月圆，月圆夜圆月圆圆，夜圆月圆夜团圆，中秋来临送祝愿，愿你福气满家园，事圆人团圆，梦圆圆梦梦儿圆！中秋快乐！,"0,1,2,3,4"
月儿高高，思念心情给你捎，开口笑笑，好彩好运一起到，心儿跳跳，迎得福气来拥抱，日子好好，幸福生活抱你腰，中秋佳节，祝愿工作事业步步高。,"0,1,2,3,4,6"
亲爱的朋友，你可否知道。我风风雨雨乞讨半年，辛辛苦苦工作一年，战战兢兢抢银行被关了两年就为了今天可以提钱前祝你中秋快乐！呵呵！,"4,5"
八月十五中秋到，合家开怀乐淘陶。桂花吐蕊芬芳笑，一片浓情心头绕。明月圆圆挂树梢，思念融融来相照。圆圆月饼盘中放，沐浴清辉分外相。中秋节到了，愿你快乐。,"0,1,2,3,4,6"
中秋明月圆又圆，照遍九州庆团圆。家家户户笑开颜，团团圆圆坐桌前。吃一口月饼品一口酒，幸福的滋味润心田。只愿人间无离散，不用千里共婵娟。祝中秋快乐无限！,"0,1,2,3,4"
我有一块月饼，不知与谁能共。多少秘密在其中，送饼之人能懂。饼外情深义重，饼内目的重重。迎来送往惧无踪，徒留一帘幽梦！祝中秋节快乐！,"0,1,2,3,4"
微风吹，天微凉，中秋到，祝福降，好朋友，祝愿你，爱情美如月饼甜蜜，事业如月光亮堂，家庭似月亮月饼圆圆甜甜。祝美满幸福、中秋愉快！,4
中秋快乐兑换支票。出票日期：中秋佳节，收款人：客户朋友，收款额：每一天的快乐，用途：中秋祝福，出票签章：财富月饼。尊敬的客户，记得兑换哦！,0
知道吗，食用月饼简称月食，打开包装叫初窥，边上咬一口叫月偏食，中间啃个洞叫月环食，一下子吃完叫月全食，没吃完就叫食剩。哈哈，预祝中秋快乐！,"0,1,2,3,4,5"
十五月儿格外明，人到中秋思念浓；桂花飘香九州欢，清辉脉脉问候行；遥寄祝福到你家，祝君坦途通仙境；快乐相伴事如意，阖家欢乐人团圆。祝中秋快乐！,"0,1,2,3,4"
圆圆的明月当空悬，圆圆的月饼味香甜，圆圆的心儿满思念，圆圆的梦想总会圆。中秋佳节庆团圆，祝你健康快乐笑开颜，吉祥如意一年年，家庭事业都兴旺，花开红艳福无边。,"0,1,2,3,4"
尊敬的客户：中秋将至，带着同一个目标，同一个中秋，同一个圆月，同样的祝福，真诚的心情，愿您中秋快乐，愿我们合作永久，合作愉快。,0
中秋节到，祝福也来到，祝你好运天天罩，麻烦不来找，幸福来关照，挫折往边靠，喜庆锣鼓敲，喜报把你抱，祝福一发到，你永远成为快乐佬。,"0,1,2,3,4"
喜欢你，因为你活泼可爱；喜欢你，因为你纯洁美丽；喜欢你，因为你宛如天仙；喜欢你，想包养你，因为知道你在月宫捣药好寂寞啊！嘿，预祝中秋节快乐！,"3,4,5"
八月十五中秋节，众星下了祝福贴，嫦娥祝你生活乐逍遥，七仙女祝你家庭事业常美满，王母送你蟠桃祝你幸福快乐每一天。八戒，还是你有福分。,"4,5"
真正懂唐伯虎的人不多，秋香算一个；懂贾宝玉的人不多，黛玉算一个；懂你的人不多，嫦娥算一个。中秋到了，八戒，别忘了去广寒宫送月饼。中秋快乐！,"4,5"
祝福订月饼：本祝福已附加订月饼功能，多种口味任选，莲蓉味请按，豆沙味请按，水果味请按，巧克力味请按，火腿味请直接按大腿。谢谢合作！,"3,4,5"
十五的情，十五的爱，实实在在我的爱，实心实意我的情，十五月儿圆，十五月儿明，照亮快乐的脸，照亮幸福的心，亲爱的，中秋节快乐！,3
看那燃放的焰火，美丽而热烈，因为它里面包含了我浓浓的思念；看月儿圆圆，幸福而美满，月光里掺杂着好运绵延。在这团圆的日子里，愿你与家人过个幸福的团圆节，祝你从此步步高升，万事皆圆满。,"0,2,4"
中秋佳节，月饼可以没有，但是祝福不能没有，祝福可以没有，但是祝福不能没有，祝福也可以没有，但是你不能没有，团圆佳节，期待你早日归家！,9
圆圆的月儿天上挂，圆圆的月饼香天涯，圆圆的快乐美如花，圆圆的祝福到你家：美满日子玉润珠圆，幸福生活花好月圆，合家吉祥永团圆。,"0,1,2,3,4"
一轮月盈，满腔情浓；一秋思，双眸朦胧；一盒月饼，团圆家中；一同赏月，其乐融融；一条消息，表我初衷。祝中秋节快乐。,"0,1,2,3,4"
圆月亮照着圆餐桌，圆餐桌放着圆盘子，圆盘子里放着圆月饼，圆月饼圆着圆圆的梦，圆圆的梦想就要圆满的实现。祝中秋节快乐！,"0,1,2,3,4"
接到玉帝指令，看在收祝福的人傻的份上，让嫦娥在中秋这天陪你吃月饼，陪你赏月，让仙女给你表演舞蹈，是不是很美？别傻了，逗你呢！中秋到了，要快乐哦！,"4,5"
人逢喜事精神爽，中秋佳节庆团圆，品品月饼赏赏月，亲亲好友多挂念，发条祝福表祝愿，身体安康要惦念，相亲相爱无间隙，幸福快乐到永远。,4
中秋，轻轻的来了，手拿一只月饼，向夜空那轮明月的方向望去，端一杯星辉，在星辉斑斓里发祝福，亲爱的们，月饼节到了，祝你幸福快乐！,4
有三个好消息要告诉你，一是中秋节就要到了，我提前祝你节日快乐；二是中秋节的月亮又亮又圆，可以免费欣赏；三是你如果送我礼物，我一定不会拒绝。,"4,5"
繁忙的时光不会停歇，而我们总会需要时间放松自己，借中秋佳节来临之际，祝您节日快乐，更希望您以后的生活事业更加顺心如意！,"0,2"
桂花香，明月满，生活甜蜜又美满；嫦娥舞，玉兔跳，好运平安来报道；问候来，祝福送，愿你事事都顺畅；佳节到，闹中秋，祝你阖家团圆乐悠悠。中秋快乐！,"0,1,2,3,4"
八月中秋月儿圆，合家团聚乐无边。瓜果丰硕来奉献，玉米青豆逐笑颜。高歌一曲全家福，曼舞两步双人欢。美酒烛光趣盎然，祝福寄情祝平安。,"0,1,2,3,4"
我大名钟秋洁，小名团圆。性格似月光般皎洁，心地良善。最欣赏的美女是嫦娥，最喜欢的宠物是玉兔。最快乐的人将会与我约会，记得带上信物月饼哦！,"0,1,2,3,4,5"
您歪才高八斗，浅见盖九州，好闲又游手，事业却上游，包里无钱币，支票成捆搂，身体不锻炼，一脚踢死牛，幸福不太长，只是到永久。祝你中秋节快乐！,"0,1,2,3,4,5"
有三个好消息要告诉你：一是中秋节就要到了，我提前祝你节日快乐；二是中秋节的月亮又亮又圆，可以免费欣赏；三是你如果送我礼物，我一定不会拒绝。,"4,5"
中秋翩然将至，祝福祝福连日，请君细细品读，字字饱含祝福：工作忙碌，身体是柱，酒宴少去，健康不易，抽烟要少，身体不倒，开车小心，看好路灯。再次真诚的祝您：身体健康，万事如意！,"0,1,2"
月亮是诗，繁星是画，愿所有的幸福伴随你，问候是春，关心是夏，愿所有的朋友真心待你，温柔是秋，浪漫是冬，愿所有快乐跟随你。祝中秋节快乐！,"0,1,2,3,4"
秋月一轮当空照，全家围坐笑开颜，开门喜迎福禄寿，端杯共举吉星高，祝福祝福接连到，条条真诚又灵验，祝中秋快乐！,"0,1,2,3,4"
窗外清风舞翩然，窗内心儿扑通跳，手机祝福滴答叫，那是祝福来报到；中秋退去国庆到，朋友兄弟来相聚，共祝国庆更美好，愿你国庆欢乐笑！,9
中秋之日，喜鹊飞进你喜气的门，百灵唱给你美好的词，众仙捧月一起下凡尘，祥云普照你们幸福的一家人，神光流动万般风韵。祝中秋快乐，众神临门。,"0,1,2,3,4"
中秋节要到，祝福该送了，你有才气有相貌，热情热心脾气好，在我心中地位高，想来想去，美好祝愿先送你最好：预祝你事圆情圆人团圆，中秋佳节乐逍遥！,"0,1,2,3,4"
客户您好，中秋将至，特送祝福，吉祥如意，跟您相伴，幸福快乐，与您相随，大富大贵，伴您左右，你我合作，财运昌盛，中秋快乐！,0
中秋节，送上一个月饼，配料：五克快乐枣，一把关心米，三钱友情水，用幽默扎捆，用手机送达；保质期：永久；保存方法：请按存储键。,"0,1,2,3,4,5"
月饼飘香，中秋圆满，生活美好，合家团圆，让我们一起庆祝这美好时刻。祝你中秋节快乐，愿我们接下来的合作更上层楼，共创我们事业的大丰收。,0
沧海生明月，皓空起相思，我送君祝福，唯恐意迟迟，冷霜打秋后，关怀行在前，天凉多加衣，无聊常消息，莫道中秋冷，与君共相知。,"3,4"
转眼将到中秋节，好运幸运装满车，烦恼如烟远飘走，一切顺利心欢悦，工作轻松有效率，钞票金条一箩箩。事业家庭都圆满，这个中秋你最乐！,"0,1,2,3,4"
中秋节将至，我用所有的祝愿做一个金蛋，里面装有健康，快乐，幸福，美满，顺利，平安；砸向你，我亲爱的客户，祝你中秋快乐，美满如愿！,0
昨晚我夜观星象，算出你中秋节过后运程大佳：好运跟踪你，幸福灌晕你，快乐降临你，爱情偷袭你，最重要是财神爷都粘着你哦！愿中秋开心！,"0,1,2,3,4,5"
中秋节到了，将月亮的圆送给你，愿你财‘圆’滚滚，将月亮的光茫送给你，愿你前途一片‘光’明，将月亮的吉祥送给你，愿你一生大富大贵。,"0,1,2,3,4"
财神到：“玉帝特派我来奖励你长期与公司的合作，现祝愿你幸福安康，阖家欢乐，如果你们今后还会这样共同合作下去，玉帝还会派我来的。”,"0,5"
送你一盒特制月饼，用关怀和面，擀思念为皮，以真情为馅，再以祝福打包送上，打开手机就可接收！虚拟的世界，只能画饼充饥，唯此情不虚也！,"0,1,2,3,4"
接到玉帝指令，看在收祝福的人傻的份上，让嫦娥在中秋这天陪你吃月饼，陪你赏月，让仙女给你表演舞蹈，是不是很美？别傻了，逗你呢！中秋到了，要快乐哦！,"4,5"
春夏秋冬四季天，人生几时得空闲；月到中秋亮又圆，放松自己许个愿；幸福生活多美梦，愿你美梦总香甜；半醉半醒似神仙，开开心心每一天！,"0,1,2,3,4"
天上月圆，人间团圆，家庭情圆，朋友事圆，心中梦圆，左右逢圆；愿你每一天中，人缘，情缘，福缘，财源，缘缘不断，事事如愿！祝中秋节快乐！,"0,1,2,3,4"
品一品月饼，快乐满心怀，尝一尝百果，如意在心间，喝一喝美酒，幸福灌心田，送一送祝福，舒心满心房，中秋节，愿你合家团圆，幸福美满，中秋快乐！,"0,1,2,3,4"
祝你：心到想到得到，福到运到财到，中秋节还没到，但愿我的祝福第一个到。提前祝你中秋节快乐！其他祝福祝福都是我安排的！,"0,1,2,3,4"
桂花清清爽爽迎中秋，月亮团团圆圆耀中秋，月饼香香甜甜庆中秋，桔柑开开心心献中秋，电视沸沸扬扬闹中秋，全家和和美美度中秋，你我欢欢喜喜祝中秋：节日快乐！,"0,1,2,3,4"
至此中秋佳节庆到来之际，公司特举行客户回馈活动，凡在中秋这天收到我们的祝福祝福，我们免费送你五千万。千万要快乐，千万要幸福，千万要健康，千万要好运，千万要发财。,0
为什么月亮这么圆，因为我对你的思念不会减；为什么月饼这么甜，因为我对你的祝福不间断。今天是中秋节，祝你节日快乐，好运连连！,"0,1,2,3,4,6"
团圆佳节在中秋，劝君更尽一杯酒，劲头十足康乐久，喜气冲天事业久，郎才女貌爱情久，清风明月好运久，顺心如意幸福久，还有我这真心实意的祝福久！,"0,1,2,3,4"
