通缉令：圣诞将近，一老者白须红袍，常趁夜色隐蔽，潜入居民家中放置圣诞礼品，发现者请速报警，报警暗号：圣诞快乐您将获得终身幸福作为奖励。,0
风雨无情人有情，牵挂之心没有停，过完冬至平安夜，圣诞祝福在进行，朋友思念情不断，一声问候心温暖。元旦问候先奉上，幸福温馨到永远。节日快乐,0
联系虽然不常有，牵挂总是没忘记，圣诞节日又临近，祝福打包全给你。考虑到过几天祝福短信铺天盖地，所以我提前行动占领高地，圣诞快乐，争当第一。,0
圣诞节想你是最快乐的事见你是最开心的事爱你是我永远要做的事把你放在心上是我一直在做的事不过，骗你是刚刚发生的事。圣诞快乐,0
圣诞节要到了，想想没什么送给你的，又不打算给你太多，只有给你五千万：千万要快乐千万要健康千万要平安千万要知足千万不要忘记我,0
圣诞节有着美丽的传说，美丽的节日送上美好的祝愿。一份祝福就有一份快乐，珍藏这快乐的短信，让我的祝福由它传达，提前祝你节日快乐。圣诞节公司祝词,0
我手捧一缕雪花，头顶两颗星辰，眼含三色秋波，口叼九朵玫瑰，脚踏十瑞祥云，以闪电般的速度冲到你的面前：圣诞快乐愿意和我一起分享圣诞吗,0
圣诞到，心欢笑，张灯结彩真美妙鹿儿跑，礼物到，铃儿叮当响云霄雪花飘，梦儿好，一声问候幸福绕花儿开，鸟儿叫，好运心意齐报道。圣诞快乐,0
圣诞树上，挂满我的祝愿点点烛光，摇曳我的思念铃儿叮当，送上我的礼物一条短信，寄托我的挂念。一年又是一年，为你祝福为你祈安。圣诞快乐,0
星光点点，烛光闪闪，温馨浪漫有你伴铃儿叮当，鹿儿欢欢，圣诞祝福低头见信息短短，情谊长长，无限相思是祝愿。幸福常常有，天天是圣诞。,0
即使雪花未舞，即使驯鹿停驻，圣诞依然光顾有了祝福，虽是寒冬冷酷，温暖依旧如故。圣诞节，我许愿：愿快乐和你相依，幸福与你作伴,0
圣诞快到了，送你三块巧克力：第一块德芙望你得到天下所有的幸福第二块金帝祝你在金色年华过着帝王的生活第三块吉百利祝你吉年百事顺利祝圣诞节快乐,0
圣诞快到了，我怕我的祝福没有悍马的力度，奔驰的速度，宝马的气度，奥迪的风度，林肯的大度，挤不上短信的高速公路，所以让祝福提前上路，圣诞节快乐,0
圣诞快到了，猪你快乐你若嫌早，就算鲜猪你快乐即使收到了别人的祝福，野猪你快乐谁都拦不了我，肥猪你快乐。严禁转发，不然的话，白猪你快乐,0
圣诞快乐只想对你说：一句寒暖，一线相喧一句叮咛，一笺相传一份相思，一心相盼一份爱意，一生相恋，那都是我思念你。,0
圣诞快乐不只这样的日子才会想起你，而是这样的日子才能正大光明地骚扰你，告诉你，圣诞要快乐新年要快乐天天都要快乐噢,0
圣诞狂欢，元旦小憩。挥手过往，尘埃落定。迎接新年，快乐无敌。放松心情，能量积蓄。共盼美好，祝福真切。闪亮人生，精彩同行。祝节后愉快,0
圣诞来到，请将烟囱架好，为圣诞老人让道请随时准备开怀大笑，将幸福的礼物揽入怀抱。在新的一年里，你会运气好，事业妙，生活步步高,0
圣诞来到，请你将烟囱架好，为圣诞老人让道请你将袜子补好挂好，准备将幸福的礼物装进腰包。祝你快乐的声声大笑，能在新的一年里穿透云宵,0
雪花还没飘下，烟花尚未璀璨，圣诞老人还没睡醒，小鹿驾车还未出发，袜子还没挂上窗前，大家的祝福还没有漫天弥漫。而我提前出发，祝你圣诞快乐，浪漫无边。,0
收一收，心情愉悦读一读，幸福蜜甜存一存，好运连连转一转，财富源源一条短信贺平安，圣诞快乐在眼前。提前祝你圣诞快乐，身体康健。一键送,0
这一天，载歌载舞载上我，不为去旅游，只为把圣诞礼物放在你的指尖这一世，转山转水转短信，不为修来生，只为幸福能与你相见。圣诞快乐,0
你好我是圣诞老人。很抱歉的告诉你，由于在过去的一年，我嘴巴馋 身体懒，吃了睡，睡了吃，因此已经发福，钻不进烟囱啦，只能口头祝你圣诞快乐,0
话藏在心底难说出口，热闹的街道不再冷清，寒冬的冷冽在不知觉间淡忘，心中盼望着圣诞来临的惊喜。我想和你说一句：圣诞陪我过，记得带钱包,0
圣诞树已装点完毕，窗外的风雪依旧不停浪漫晚餐已准备就绪，午夜的钟声即将响起。圣诞即将来临，我想轻轻传我心意：祝你圣诞快乐，礼物拿来,0
大风起兮雪飞扬，圣诞来临心盼望，期待与友诉衷肠，好想祝福送双双，满心的欢喜字里藏，短信送你运吉祥，圣诞快乐尽情享，节日快乐无疆,0
我给你唱一首歌，快乐与幸福相和，歌声婉转悠扬，飘荡在你一生的岁月我给你写一首诗，好运与如意相陪，诗歌清新自然，弥漫在你以后的经年我给你发一条短信，圣诞与平安相伴，短信内容大意是说，圣诞快乐，一生快乐,0
圣诞老人，跨千山万水，经一夜风雪，给你送来圣诞礼物，我的信息，记一生好运，载一世幸福，辗转到你的手机里，打开看看，圣诞快乐,0
儿子问爸爸：“爸爸，圣诞老人什么时候来啊”爸爸说：“等到你睡着的时候。”小狗问妈妈：“妈妈，圣诞老人什么时候来啊”妈妈说：“等到小猪看到圣诞快乐的时候。”嘿嘿嘿亲爱的朋友，圣诞快乐啊,0
圣诞节日到，打个哈欠，伸个懒腰，烦恼消消，忧愁忘掉，忙里偷闲，好运连连，收个短信，祝福不断，事业高升，如意一年,0
欢喜欢笑，我们一起欢度，歌声歌舞，我们一个歌唱，圣诞狂欢，我们一起烂漫，幸福生活，我们一起走远，圣诞节到来，愿亲爱的你心情快乐，欢喜连连，好远不断，幸福缠绵。,0
愿你头顶幸福天，天上掉馅饼脚踏如意地，地长人民币手拿快乐刀，伤心难过不敢靠嘴吃甜蜜桃，幸福天天来拥抱，一时一刻不敢跑祝猪你圣诞快乐,0
圣诞到来，圣诞老人，坐着飞机，飘洋过海，送你礼包请查收：身体强壮无恙生活幸福快乐亲友平安顺利，美梦全都实现,0
圣诞节到了，我为你精心准备了一件礼物，当你揭去烦恼的纸包，打开幸福的盒子，就会看到我用真心写下的祝福：亲爱的，圣诞节快乐,0
亲爱的，圣诞节到了，我没有准备巧克力，但我可以给你一辈子的甜蜜我没有准备高档礼品，但我可以给你快乐的一生我没有准备香槟美酒，但我可以给你幸福的天长地久圣诞节快乐,0
说起来，圣诞节是个洋节听起来，圣诞节，和你关系不大过起来，圣诞节特别重要因为，我为你准备了一份圣诞礼物礼物是：圣诞快乐，一生幸福,0
圣诞节到了，我没有什么可送你，就送你三块巧克力好了，愿你生活精彩真给“力”，工作热情多努“力”，爱情高歌定顺“利”,0
圣诞节，送你一棵圣诞树，圣诞树上结幸福，幸福里面含快乐，送你一张圣诞卡，圣诞卡里写祝福，祝福里面是问候，送你一条短信息，信息里面藏心愿，心愿就只一句话‘愿你圣诞节快乐’。,0
幸福之前，我祝你平安，快乐之前，我祝你安康，辉煌之前，我祝你奋进，坎坷之前，我祝你挺拔，困难之前，我祝你坚毅，曲折之前，我祝你顺心，新春之前，我祝你发财，元旦之前，我祝你圣诞快乐,0
平安夜里钟声响，温馨祝福快传递，一条短信发出去，情真意切表心意，圣诞节钟声响起时，祝福按时到了，祝吉祥幸福如意快乐好运。,0
圣诞节到，让微风把我的祝福捎到，愿你财到，福到，平安到，让真情随雪花飘到你的身旁，愿你身体倍棒，精神气爽，斗志高昂。,0
圣诞节日到来，快乐与你同在，心中充满阳光，满心都是温暖，世事充满变幻，你我友谊至上。在圣诞节里祝愿亲爱的朋友一生一世幸福快乐,0
圣诞节日到，三双袜子送给你。一双装礼物，礼物多多堆成山一双装幸福，健康快乐到永远一双装烦恼，忧心积虑全抛掉。礼物送到，不要嫌弃。,0
日复一日又过去，圣诞节日悄然至，平安夜里送平安，圣诞树上挂狂欢，圣诞老人送礼物，袋里全是我祝福。祝圣诞节万福万好。,0
圣诞节到了，我委托圣诞老人送你一个装满礼物的袋子，里面装着爱心关心温暖温馨祝福祝愿，祝你圣诞节喜气洋洋快乐永享福到运到。,0
渴了有水，饿了有米，寂寞了有我，圣诞节日有礼物：此物遇情而生，遇感而发，遇电而飞，遇机而入，欲知是何物，打开手机，上抒圣诞快乐，下写幸福美满，祝你金玉满堂，容光焕发，圣诞快乐,0
圣诞节快到了，提前送你一份幸福，一份甜蜜，一份快乐，一份财富，一份健康，一份吉祥，一份如意。愿我们的友谊长存，愿你圣诞快乐。,0
真正的爱情是“圣”洁的，爱情像柏树做的圣“诞”树，任风雪吹打，完整依旧，像树上挂满的礼物，幸福甜蜜美好圣诞节了，祝福你们的爱情,0
开心的心情，即将奔放，欢喜的祝福，即将远航，幸福的日子，即将陪伴，圣诞的钟声，即将相伴，美好的生活，愿你欢喜不断，圣诞节的狂欢，愿你潇洒无憾。,0
我最近很忙，忙着和外星协商联欢，忙着和宇宙搞搞关系，可一想到圣诞到了，你在等我祝愿，我就飞回地球和你碰面圣诞节，不见不散哦,0
圣诞节是很特别的一天，我诚心向福禄寿喜四位神仙许愿，愿你的圣诞礼物及时出现，愿今后的你好运连连，成功无边，健康无限，幸福绵绵。收到祝福，心如所愿。,0
圣诞节，情无限圣诞夜，夜无眠圣诞树，金光闪圣诞雪，白透灿圣诞灯，红中艳圣诞风，冷中暖圣诞歌，暖心田圣诞情，人人传圣诞心，暖人间圣诞福，礼不断给礼物，送祝福祝福你，祝福我爱的心，伴永远，爱的情，传长远。圣诞节快乐,0
雪花在飞舞，寒冷在咆哮，圣诞老人驾雪橇华灯放光彩，烛火在燃烧，圣诞钟声迟未到不要太心急，静待岁月好，短信祝福先送上，祝你圣诞快乐，开心每天,0
圣诞节日到，狂欢一整宵，等待钟声响，等待烟火放，站在广场前，记得多穿袄，欢喜的日子，预防感冒，记得吃火鸡，别忘看短信，圣诞快乐,0
短信打开，祝福连连，快乐不断，圣诞节日，礼物如山，华灯放彩，烟火冲天，新的一年，身体安康，幸福永远,0
圣诞节，铃铛响，祝福短信不能忘。圣诞树，好漂亮，快到广场去照相。玩气球，玩人狼，热闹到大街小巷。出去玩，要保暖，安全知识不能忘。防拥挤，防小偷，圣诞过高高兴兴,0
雪花还没飘下，烟花尚未璀璨，圣诞老人还没睡醒，小鹿驾车还未出发，袜子还没挂上窗前，大家的祝福还没有漫天弥漫，提前祝你圣诞快乐，浪漫无边。,0
圣诞到来过圣诞，亲朋好友贺平安，好礼相送一大串，祝福送来好运连。祝愿亲爱的朋友健康拥抱，幸福环绕，成功开道，甜蜜微笑，圣诞节快乐,0
你知道圣诞老人在哪里吗去年他拿走了我的袜子你也要小心呀,0
带给你，平安夜，狂欢夜，有你有丽才精彩。,0
无论我在哪里，我离你只有一个转身的距离，让我的心陪你在这个平安夜里的共同舞起。,0
因为有爱，生活变成幸福。因为有你，这个圣诞变得快乐。,0
我想把我的手放在你的手里，让你领我走进圣诞节的教堂，过我们俩人的圣诞节,0
随着圣诞的到，来空气中弥漫了欢乐的气息。一如我的心情，让我今夜共唱赞美诗乞求明天会更好。,0
柔柔的白雪在圣诞的夜空飞舞，想你的心情依然如故，只是你也如我一样想你想我吗,0
亲爱的这个祥和的夜晚我将在梦中与你度过,0
岁月如诗，句句悠扬。友谊如歌，余音绕梁。温馨季节，思念满怀，愿你圣诞快乐,0
爱是雪，情是花，变成雪花飘你家，铃儿响，鹿儿跑，把我的心儿带给你，平安夜，狂欢夜有你有我才出色,0
如果圣诞老人给我一个机会，我会对你说：圣诞快乐一定要在快乐上加上一个期限，我希望是：一万年,0
在这一年中最浪漫 最温馨的日子，让我们在一起好吗圣诞快乐。,0
心在飞扬，情在高昂。平安夜让我们一起，去聆听圣诞的钟声好吗,0
一个人时不寂寞，想你的时候才感觉寂寞。今个圣诞节我会最最寂寞。,0
平安夜的钟声敲响的时候，那是我思念你的心在呐喊，愿你快乐平安,0
安夜平平安安，圣诞节快快乐乐。爱你一辈子,0
孩子，我是圣诞老人，有一份圣诞大礼要送给你。什么你们家没有烟囱还不去买,0
圣诞，有圣诞老人，有你也有我，在这日子里，我想对你说，世上你最美，在今生我最爱你圣诞快乐,0
平安夜的每一朵雪花飘下，每一个烟火燃起，每一秒时间流动，每一份思念传送。都代表着我想要送你的每一个祝福,0
圣诞夜了无数的星辰亮起，在天空写下你的名字，当雪花飘落时，就能将我的思念与祝福传送给你,0
愿明亮喜庆的圣诞烛光温暖一年中的每个日日夜夜，祝你欢欢喜喜度圣诞，高高兴兴过新年,0
圣诞来临，祝新年快乐，愿你时时刻刻幸福欢乐,0
愿你的圣诞充满温馨 祥和，与亲人团聚的快乐，祝圣诞乐陶陶，新年乐无限。,0
圣诞快乐，衷心祝福来年快乐 幸运,0
平安夜，报平安，今夜如果祥和的旋律从你的梦中流过，那么你是否想到，那是我跨越关山千万重来入梦，送给你我最真挚的祝福,0
平安夜了，我希望你在平淡的日子里能够安心的生活希望你永远平安。,0
平安夜到啦，我带上圣诞帽，穿上圣诞衣，乘上爱的鹿车，为你送上精心备至的礼物，记得在床头挂上你的臭袜子噢，哈哈，祝你圣诞节快乐。,0
祝天下所有的善良人好人2015年圣诞节开开心心，快快乐乐2016年平平安安早发大财百业兴旺，家庭和顺，万事如意,0
平安夜点起一盏烛光，照亮我们的前程燃烧一座火炉，温暖我们的人生挂起一只袜子，装满我们的梦想垒砌一个烟囱，让幸福自由上升。圣诞节快乐,0
再多再花哨的言语也抵不过一句平平安安来的更重要，圣诞快乐,0
圣诞老人说所谓幸福是一个有健康的身体有深爱你的人一帮可依赖的朋友当你收到此信息时一切随之拥有,0
这是我发给你的三天后的信息别偷看哦叫你别看还看祝你圣诞快乐,0
圣诞节到了耶你有没有在床头挂起臭袜子哦圣诞老公公会把我最好的礼物丢进去的圣诞快乐,0
圣诞老人说今年他要把礼物装在我们两的袜子里所以平安夜你一定要陪在我身边,0
在这洋人的节日里好想和你在一起享受这醉人的气氛然而你我分割两地我只好在这轻声地对你说：“亲爱的圣诞快乐”,0
想念你的笑想念你的外套想念你白色袜子装满圣诞的礼物,0
以往的圣诞都是灰色的今年有了你一切都变得不同我的世界一下子变得豁然开朗多姿多彩我衷心地谢谢你,0
我没有华丽的言语，没有虚无的甜言蜜语，没有浪漫的修辞，但是我有一颗爱你的心，一颗愿意陪你观赏初夏秋冬的心，一颗真心待你的心亲爱的，圣诞快乐，有你每天都是节日，有你每天都是幸福的,0
圣诞树上挂礼物，圣诞衣中藏祝福。红红火火福永驻，快快乐乐无痛苦。祝福声声友情护，圣诞佳节笑处处。祝圣诞快乐,0
雪飘的日子，欢乐的节日，勤劳的驯鹿，慈祥的老人，傻睡的你。最珍贵的礼物，是温馨短信，传送最真心的祝福给你：祝圣诞快乐,0
雪花飘飞的季节，是烂漫的书写，圣诞的祝福请别拒绝，友谊之花从来不会谢，思念之泉永远不枯竭，真挚祝愿你圣诞佳节开心快乐,0
我要把一切喜讯变成奶油所有祝福柔成巧克力所有快乐做成蛋糕答谢你然后说声圣诞快乐,0
送你一颗聚满礼物的圣诞树顶上最大最亮的那颗星是我的真心挂的是我的痴心制造材料的是我一颗不变有心：圣诞快乐,0
我默默祈祷愿圣诞老人能在即将到来的圣诞之夜送我一个与我牵手同伴共同度过这奇妙的圣诞夜结果他将你送给我,0
考虑到24小时之内将会有铺天盖地的祝福短信堵塞网络一向有远见聪明的我提前恭祝圣诞快乐 新年快乐,0
如果每年的今夜有一个很肥的老人从窗口跳进来抓住你把你装进袋子里你不用担心因为我想要的圣诞礼物就是你,0
也许岁月将往事退色或许空间将彼此隔离但知道珍惜的依然是真心的友谊将再次对你说声圣诞快乐,0
好事如意蛋砸你头儿，因为你是幸运蛋儿轻松高薪蛋砸你头儿，因为你说吉祥蛋儿快乐长久蛋砸你头儿，因为你是幸福蛋儿爱情甜蜜蛋砸你头儿，因为你是宝贝蛋儿圣诞祝福砸你的头儿，因为短信送傻蛋儿嘿嘿，圣诞节快乐,0
超检查你怀了一个蛋，还有一周就要生了。提前祝你生蛋圣诞快乐，不准不发，发给20个好友，我要你幸福 不管你在不在都要发给你： 因为有你这个朋友才是幸福的 想起谁 发给谁 也包括我 发给二十五个好友 如果有十个回你 你将在二零一五年和你最爱的人在一起别小气 不许在你这断了 哈哈，好冷哦，那我就提前祝你圣诞快乐哦。男女都发偷笑,0
我刚看到新闻说，一男的做手术被误切了一颗蛋蛋，医院赔了200万。我一想到每天自己夹着400万的东西到处乱跑，立马腿就软了贵重物品，请各位妥善保管。提前祝各位剩蛋快乐博君一笑,0
圣诞节祝福语，如果你今天没收到我的圣诞礼物，那一定是因为你的袜子有个大洞 快补补吧,0
去年圣诞你在我袜子里放了枚钻戒于是我给你洗了一年臭袜子上天再给我次机会我会说还为你洗袜子一辈子老公我爱你,0
圣诞老人留言：因昨晚没有袜子装礼物，只好折成现金存入你的账户请务必在一小时内查询六次信用卡账户，即可到账,0
在隆冬来临之际，希望你身体健康，永远快乐的就像炉子上的水壶一样，即使屁股烧得红红的，也依然快乐的吹着口哨幸福的冒着鼻涕泡泡。圣诞节 来临了，朋友，祝你节日快乐,0
平安夜的祈祷， 圣诞节 的心愿，新年的祝福，寄托给满天的星斗，带给你我真挚的问候：朋友，开心快乐,0
如果有一个白胡子老爷爷从窗口爬进来，把你装进袋子里，你一定不要惊慌，那是我告诉圣诞老人我最想要的礼物是一个象你这样的朋友,0
天空飘落的雪花，就象我的心情，思念不断蔓延，从遥远的另一端努力奔向你，不能相伴，情愿化做雪花，将你砸的人仰马翻,0
贪睡的拉出去放牛不想我的刑事拘留忘了我的一律斩首不给我电话发配西藏驯猴善良的我提前祝圣诞快乐有比我早发的送出地球,0
一个人的圣诞夜很冷二个人的圣诞夜，会出轨今晚你愿意陪我出轨吗圣诞夜只想对你说：我爱你的圣诞礼物在雪花还没有飘落，圣诞神灯还没有点亮，圣诞靴子还没有挂起，带小红帽的圣诞老人还没有到来的时候我早早给你送去祝福：圣诞快乐,0
这个月因有 圣诞节的到来而使我的心情好了许多在这个月，送上我最真挚的祝福愿你也能快快乐乐的忘记一切烦恼,0
圣诞老人穿着艳艳红衣，却不及你面颊一抹娇羞圣诞树郁郁葱葱，却不及你倩影婷婷玉立拉雪橇的鹿儿活泼快乐，却不及我见到你的欢欣雀跃，圣诞快乐,0
我点击整个冬天看到了你的笑颜，我复制你的笑脸粘贴在我的心间，我下载我的思念把它另存为永远，我打开我的手机给你最美好的祝愿：圣诞节快乐,0
没有雪花即使不浪漫我们也可以过圣诞，有了祝福即使是寒冬也能够感到温暖平安夜我在许愿：愿你永远平安愿幸福和你终生相伴愿你的礼物堆积如山,0
海有多深只有鱼儿才知道天空有多高只有鸟儿才知道花儿有多红只有蝶儿才知道爱你有多深只有看短信的你才知道。平安夜，我要你好好抱抱我,0
平安夜我向圣诞老人许愿：希望不管你脚多么臭，明早当穿起袜子时，能收到我给你的满满的祝福，温暖你的心和脚ㄚ子,0
年圣诞节平安夜搞笑短信【篇2】,0
嗨你怎么还在这呢。。你知道你的重要性吗没了你，谁拉着圣诞老公公去给大家送礼物啊呵呵，圣诞快乐,0
在这一年一次的圣诞节，请上帝给我勇气和力量吧，我一定要对你说出那3字：快还钱,0
如果有个胖红衣老人从窗户爬进你屋子把你装进口袋不要怕因为我对圣诞老人说“想要你这样的朋友”,0
如果说圣诞老人要我只许要一个礼物，么我会对他说：“一个正在看这则短讯的人做我的礼物，生世世陪伴我”,0
有句话每年圣诞我都想说，可是苦于没有机会，现在我实在憋不住呢请把你留在我床上的臭袜子拿走。,0
圣诞老人，你现在已经收到了我的祝福，请马上跑到烟囱口处等待礼物的派送吧，谢谢。 轻声问候 真挚祝福，愿快乐常伴你左右，愿你拥有满怀的欢欣 丰收的希望，洋溢在这新的一年。,0
一天我擦亮阿拉丁的神灯，灯神说：我会满足你一个愿望。我说：请祝福正在看短信的人圣诞快乐,0
孩子，我是圣诞老人，有一份圣诞大礼要送给你。什么你们家没有烟囱还不去买,0
如果圣诞老人给我一个机会，我会对你说：圣诞快乐一定要在快乐上加上一个期限，我希望是：一万年,0
当钟声响起，我就是你的别想错了，不是婚礼上的钟声，是圣诞的钟声，而我是你欠给礼物的人,0
送你一棵圣诞树，树根是健康的体魄，树干是幸福的家庭，树枝是顺心的事业，树叶是美满的爱情。,0
星光闪闪，烛光闪闪，叮叮当，叮叮当，可爱仁慈的圣诞老人从天而降，带来人间无数温馨快乐，更带来我对朋友你的祝福：圣诞快乐,0
每一朵雪花飘下，每一个烟火燃起，每一秒时间流动，每一份思念传送，都代表着我想要送你的每一个祝福，圣诞快乐,0
春节人们用筷子吃饺子，中秋节人们用手吃月饼，圣诞节人们用刀叉吃烧鹅。现在，圣诞节快到了，你还是躲一下吧，免得刀叉落到身上。,0
“平安”：你的心愿，我的心愿，连成一个“同心圆”你的平安，我的期盼，写成一个“和谐梦”平安夜，一串祝福，一份心意，愿你平平安安快快乐乐,0
“圣”说：有立足之土，快乐会永久。“诞”说：说出思念话，幸福会到手。“节”说：即使是小草，终有出头日我对你说：圣 诞 节的祝福全送给你。,0
“圣”旨到，要“诞”淡定，“节”快乐。圣诞节，愿你永远拥有10岁的心情，20岁的容貌，30岁的身材，40岁的风情，50岁的智慧，60岁的豁达，70岁的坦然，80岁的无所谓，90岁的超凡脱俗，100岁的快乐似神仙。,0
【平】生与你最有缘，【安】得与你度圣诞，【夜】夜辗转难入眠，【快】把祝福短信传，【乐】趣多多迎圣诞【平】【安】【夜】【快】【乐】,0
12月将至，有1美国的火鸡来到中国找女友，忽然看见1美丽的中国母鸡，便主动上前搭讪到“ ”，母鸡不语，后，火鸡又言：“生蛋快乐”母鸡默。几秒钟母鸡言：你是站着说话不腰痛啊。你没有生过孩子，你怎么理解生孩子的痛苦啊,0
24号晚从你家烟囱钻出英俊小伙别慌张，那是圣诞老人他整容了在韩国做的，他想给大家个惊喜，我只告诉了你千万别外传,0
，你怎么还在这啊，你知道你的重要性吗没了你，谁拉着圣诞老公公去给大家送礼物啊，圣诞快乐,0
皑皑白雪铺满地，雪花飘飞圣诞日。小鹿蹦跑送安康，雪橇满载幸福溢。圣诞老人着盛装，吉祥如意满身上。佳节分身好理念，街口家户都有影。笑颜无声送吉祥，启门迎纳福绿寿。祝你圣诞心里美，生意兴隆纳四海。和气生财迎八方，善行济世名望传。,0
爱不需要多，只要有你就够了 你在我心中是最美。没认识你之前，我还不知道世界上有这样一个人，会让我茶不思，饭不想。 不要怀疑，这就是你的魔力。我爱你这是唯一一句。,0
窗外的雪花在天空飘遥，教堂里的赞美诗在人群流动，我在祈祷，你快回来，我要对你说“没有你我不行”。,0
