十五春暖闹元宵，千家万户欢声笑。大街小巷花灯展，秧歌狮子踩高跷。农家小院歌声飘，酒香情浓度元宵。欢聚一堂亲友情，高兴无眠全喝高。愿你元宵甜蜜蜜，酒醉心明笑嘻嘻！,3
正月十五闹元宵，家家户户好吵闹。亲朋好友都邀请，划拳饮酒骰子摇。欢天喜地开心笑，吵闹邻居只管叫。月圆节圆人有缘，汤圆甜蜜幸福耀。愿你十五元宵闹，吉祥好运把你照！,3
花红柳翠十五到，圆月高悬家乡照。非同寻常你来瞧，农家小院最热闹。亲朋来汇全请邀，大餐酒宴款待招。甜蜜汤圆不能少，吃饱喝足乐逍遥。燃放鞭炮欢声闹，醉意悠然唱歌谣。愿君元宵节日欢心笑！,3
明月初圆佳节到，开开心心人欢笑。大街小巷人如潮，观灯猜谜多热闹。更有龙灯和高跷，舞得精彩人称道。亲朋好友聚一堂，共品汤圆度良宵。祝元宵节快乐围绕！,3
灵蛇飞舞的第一个月圆，我要送你祝福无边。祝福你的梦想比月圆，愿你的爱情比蜜甜，愿你的生活里事事美满，好福气天天用也用不完。祝你元宵节快乐永远！,3
亲，元宵节来了，又团又圆的汤圆就要出锅了，宝贝你可得少吃点，今年的汤圆都被下了诅咒的，吃一个脸圆，吃俩腰圆，吃仨浑身圆。哈哈，元宵节快乐！,3
漫天烟花送祥瑞，有情人儿来相会，大伙齐把汤圆备，热热闹闹花灯会，愿彩灯给你带去色彩缤纷的前程，愿汤圆给你带去圆圆满满的生活，元宵节快乐！,3
正月十五又来到，团团圆圆祝福到。祝你生活美好甜如蜜，事业辉煌节节高，前程似锦身体棒，心情愉悦笑口开，长命百岁乐逍遥，一生平安万事兴。,3
今夜月儿圆，送上一碗圆圆的汤圆，黏黏的都是思念。今夜花灯传，火树银花妆点新的一年。今夜举起酒杯，祝福的话儿说不完。祝元宵节快乐！,3
蛇年元宵到，竹板那么一打呀，说说俺的祝福语，祝大家，元宵佳节嘻哈哈，万事如意好梦圆圆欢欢喜喜全家乐！元宵快乐乐无穷！,3
元宵节，节元宵，生活滋润乐呵呵。汤圆好，好汤圆，团团圆圆身体棒。春节已过，元宵来临，祝你节日快乐，开心每一天，幸福一辈子。,3
载歌载舞闹元宵，映日灯笼别样红，祝愿你生活如春光灿烂无比，事业如歌声嘹亮强劲，梦想如礼花绚烂绽放，爱情如元宵甜蜜香浓，元宵节快乐哦！,3
烟花璀璨，带给你祥和好运，爆竹声声，唤醒你的凌云壮志，欢笑阵阵，释放你美妙的心情，祝福绵绵，深情祝福你元宵节开心，喜事多多，快乐每一秒！,3
瑞蛇腾飞送你满满福气，花灯闪烁照亮你梦幻未来，礼花漫天播撒你好运无边，元宵圆圆圆了你的好梦，祝福甜甜甜蜜你的生活。亲，元宵节一定要开心哦！,3
汤圆香，汤圆甜，香甜的日子很幸福，彩灯绚，彩灯美，绚美的生活很红火。月儿亮，月儿圆，亲切的问候很温馨。亲，祝你元宵节快乐，幸福团圆。,3
如意彩灯妆点欢庆元宵的华章，美好的夜晚，明月圆圆送上这一年万事团圆。香甜的汤圆，美好生活开始在这新年的春天。祝元宵节快乐！,3
宵到，乐开怀，喜迎佳节，鸿福满门庭。祝福送，心洋溢，辞旧迎新，好运伴终身。在这充满欢笑的日子里，请让我真诚的告诉你亲，节日快乐！,3
元宵，元宵，锅内飞跳，三分喜庆，七分问候：恭喜发财身康健，事业有成顺如愿，日子甜蜜幸福长，一年更比一岁强。如愿！如愿！,3
送你开心，笑意盈盈；送你诚心，好运不停；送你顺心，万事如意；送你真心，幸福洋溢；送你短信，代表元宵；馨香入心，伴你终生。元宵节快乐！,3
正月十五闹元宵，缘来一家人，围坐后花园，圆圆的月亮高高挂，圆圆的元宵碗里躺，抬头望圆月，低头吃元宵，喜庆迎团圆，幸福满园香！,3
圆圆蛇年圆圆运，圆圆元宵圆圆福。圆圆灯笼圆圆红，圆圆快乐圆圆送。圆圆成功圆圆逢，圆圆健康圆圆梦。圆圆如意圆圆连，圆圆祝福祝团圆。,3
蛇年元宵圆又圆，祝你心想事成好梦圆，幸福美满家团圆，工作顺利事业圆，招财进宝运气圆，快乐相伴日子圆，健康平安生活圆！,3
花初放，香自藏；花灯上，谜自忙；黄昏树梢手牵牢，花好月圆人兴旺。亲爱的朋友，元宵节来临，愿你有个幸福快乐的心情！,3
问世间，何为贵？山以青为贵，水以秀为贵，物以稀为贵，月以明为贵，人以正为贵，友以挚为贵，情以真为贵，我以你为贵！祝你元宵节快乐！,3
庆元宵，良辰美景展笑颜。吃汤圆，甜甜蜜蜜合家圆。赏花灯，红红火火如意年。祝贺您，花好月圆人团圆。,3
不许动，举起手来，把你的幸福全部交出来！否则我将没收你过元宵节的权利！同时将你的情人节改为光棍节！嘿嘿嘿，哈哈哈！,3
张灯结彩过十五，欢天喜地庆元宵。一束烟花带给你辉煌一年，一碗汤圆带给你圆满的一年，一年又一年，我祝你年年精彩。元宵节快乐。,3
请站到窗边，看窗外的圆月。那一束束月光，把我的祝福和思念一起传递给你！元宵节快乐！！,3
亲爱的，我要点很多灯笼，每一盏灯笼都闪烁着我对你的思念，我要送你很多汤圆，每颗汤圆都包含着我对你浓浓的爱，漫天烟花绽放我们的幸福。元宵节快乐,3
火树银花闪耀着幸福的光芒，桨声灯影流淌着喜庆的欢笑，颗颗元宵映照着合家团圆，盏盏明灯照亮了锦绣前程。今夜无眠，欢天喜地闹元宵，元宵节快乐！,3
日圆月圆天地圆，人圆梦圆事业圆，祝您及家人元宵节团团圆圆，幸福美满！,3
正月十五吃汤圆，吃得家庭团圆，爱情甜蜜，生活饱满！张灯结彩庆元宵，花灯照得前途光明，事业发达，前程似锦，每个日子都喜气洋洋！元宵节快乐！,3
又是一年喜佳节，龙年元宵更欢腾。吃汤圆赏花灯猜灯谜，闹得又一年好日子红红火火；舞龙舞狮扭秧歌，跳得又一载事业飞黄腾达家庭兴旺！元宵节快乐！,3
元宵佳节睁开眼，祝福送上门，今年开好头，龙年没忧愁，生活特顺心，笑容天天有，家人和和睦，亲人如蜜友，龙年喜事多，来年还会有。祝你元宵节快乐,3
元宵节又到了，我又不住了，决定给你发条祝福语短信，愿你新的一年吃好；喝好；睡好；工作好；什么都好。祝元宵节快乐哦。,3
元宵到了，送你一副对联。上联是元宵好，元宵妙，元宵时节祝福到；下联是心情爽，心情俏，心情愉悦幸福绕。横批：元宵节快乐祝你团团圆圆，笑口常开,3
春节激情刚退，元宵节又到位，继续餐餐美味，注意保养为最。元宵节快乐！,3
元宵节送您一碗汤圆，将圆起一场事业的美梦，圆出温暖如春的爱情，圆得家人幸福的团聚，圆来新一年精彩的运程元宵快乐,3
额圆面嫩外表白皙，多情含蓄心甜如蜜，肤靓美体蕊红艳绿，温柔甘饴令我痴迷，十五灯夜吻你吃你别紧张，我说的是元宵元宵节快乐哦,3
元宵佳节明月圆，人间欢乐庆团圆，花灯照亮好前程，日子好比汤圆甜，健康快乐年过年，万事乐观随心愿；祝元宵节快乐！,3
又到元宵佳节日，糯米汤圆当主食，美味应当趁热吃，馅料优选坚果类，芝麻花生和豆沙，含有蛋白矿物质，甜蜜幸福在咫尺！,3
正月十五闹花灯，万家灯火齐通明，明月生辉度佳节，烟花璀璨耀全城，五福齐天乐融融，团团圆圆享人生。祝元宵佳节顺心顺意！,3
彩灯杆上挂，彩云空中飘。和风报春晓，人比春光娇。新春大展颜，美好尽琢雕。和美大团圆，十五闹元宵。元宵节快乐！,3
收到我的祝福的人永不被炒；阅读的人会飞皇腾达；储存的人会爱情甜蜜；删除的人会好运连连；转发的人薪水猛涨！元宵节快乐！,3
亲爱的告诉你一个秘密：第一次见你便被吸引，乌黑的发质、明亮的眼睛、突出的性感嘴唇、优美的身材。啊！我的德国黑贝。元宵节快乐！,3
滚滚滚滚滚滚滚滚滚滚滚滚滚滚滚滚，元宵节将至，我滚个大元宵送给你，祝你元宵节一家团圆，合家欢乐，幸幸福福，美美满满。,3
小白兔，白又白，千年捣药在瑶台；今见人间花灯悬，背着主人来下凡，吃元宵，逛灯会，热闹景象令它醉，汤圆真是很美味，不是对不起它的胃。记得吃哦！,3
元宵个头圆又圆，祝你生活比蜜甜；元宵模样光又光，愿你身体很健康；元宵外表滑又滑，金银财宝一把抓；元宵佳节，祝愿尊贵的你，全家幸福笑哈哈！,3
十五的灯笼高高挂，人人脸上笑哈哈，全家团圆吃元宵，父母心里乐开花，就算工作再劳累，陪伴父母第一位。祝你元宵节，家庭团圆，幸福快乐！,3
十五元宵登场，热闹气氛非常；屋外礼花齐放，屋内喜气洋洋；幸福汤圆下锅，热气露出吉祥；冒出幸福气泡，煮出团圆安康；祝朋友元宵节快乐！,3
花灯太多，看不见你的身影；灯谜太深，猜不透你的心情；灯客太多，抓不住你的手心；灯火太快，错过了你的生命。亲爱的，元宵节，格外想你！,3
粘粘的糯米黏住一生的快乐，香香的馅儿吃出一生的甜蜜，咬出明日希望，咽下万种柔情，从此无灾无病，团圆美满乐在其中！元宵节快乐！,3
花灯吐艳映新春，汤也圆圆福也圆圆；良宵美景迎佳节，事也圆圆财也圆圆；笙歌一曲唱佳音，人也圆圆心也圆圆。恭祝元宵佳节，好梦圆圆！,3
今川印明月，元宵月醉明。虎年送你三盏灯：一盏猛虎灯，祝你壮志如虎威二盏瑞虎灯，愿你吉祥好运升三盏欢虎灯，望你开心乐一生,3
祝福向钱前看，钞票向厚后赚，虎年第一个月圆日元宵节就到，在这风暖雨润的季节，在这充满柔情的日子，请接收我提前送出的祝愿：元宵快乐！,3
把碗问青天，月圆照汤圆。不知碗中汤圆，到底甜不甜。别想啦！元宵节还未到，但我的短信已到，提前祝你元宵节快乐，愿今年的第一轮圆月带来你一年好运！,3
月圆之夜，赏灯观月，品味汤圆，家人团聚，聊人生百态，道世间情缘，惦记远方亲朋，祝福你我传送，元宵节之际，愿你和你的家人能过的快乐！,3
天上星，亮晶晶，元宵夜，盛满情，吃元宵，要尽心，赏花灯，必顷心，写短信，送祝福，捎给你，表我心。元宵节快乐！,3
铃声滴答，朋友牵挂，花前月下，爱情童话，赏灯观月，浪漫前踏，短信传送，友谊不差，元宵节，祝你开心快乐不必惊讶！,3
今夜，让我静静地想你。将圆圆的明月，放进你的心里。柔柔的月光伴着幸福的香味，圆圆的元宵带着快乐的祝福，一起拖着你的梦想，今夜成真！,3
吃过喜庆的水饺，吃过长寿的面条，迎来团圆的元宵。元宵佳节就要到，亲手包只元宵送给你，我已经为你包进平平安安，包进顺顺利利，包进团团圆圆！,3
月圆月圆，团团圆圆。汤圆汤圆，圆圆满满。首轮圆月将来照，春节结束在元宵。祝愿寄达收存好，愿你生活走向高。天天如意好运道，时时开心乐滔滔！,3
元宵就到，汤圆亲手为你包。包上芝麻，愿你好运发达；包上红糖，愿你甜蜜如糖；包上红枣，愿你生活步步高。短信一条，把祝愿带到，预祝元宵快乐,3
春节在今天结束，今天是上班后的第一个周末，虎年的第一轮圆月在今天升起。今天是元宵佳节。在这美好的时刻，诚心祝愿，我的朋友，一切如愿！,3
虎年元霄喜事多朋友祝福好又多：合家团圆幸福多，身体健康快乐多，虎年吉祥好事多，薪水猛涨钞票多，心情愉快朋友多，福星高照平安多，爱情甜蜜咬耳朵,3
虎年元霄特别圆，小小汤圆到跟前。快乐活面更筋斗，开心为馅味道甜。放到健康水里煮熟，幸福小碗一碗端。为何汤圆味更鲜？我的思念在里面！元霄快乐！,3
春节前后没谋面，节前假后没做伴，宵夜早茶没约见，相会团圆暂无缘，朋友情谊记心间，思念惦记梦无限。眼看春节要过完，只好发个短信照个面！元宵快乐,3
年过完了吧，人跑烦了吧，钱花光了吧，心也疼了吧，短信少了吧，没人理了吧，野不成了吧，老实上班吧，幸亏还有我预祝你元宵节快乐,3
元宵节祝福年过完了吧，人跑烦了吧，钱花光了吧，心也疼了吧，短信少了吧，没人理了吧，野不成了吧，老实上班吧，幸亏还有我祝你元宵节快乐！,3
三五良宵，花灯吐艳映新春；一年初望，明月生辉度佳节！在这快乐分享的时刻，思念好友的时刻，美梦成真的时刻，祝你元宵快乐，团圆美满！,3
当你读这短讯，你已欠我一个拥抱；删除这短讯，欠我一个吻；要是回复，你欠我全部；要是不回复，你就是我的了。,3
元宵夜，你只要对月亮盈盈一笑，月亮就变成月食。这一刻，伟大的西施在你身上灵魂附体，你一个人代表了中国美女悠久的历史和传统，你就是当世的闭月！,3
正月十五喜庆多，合家团圆幸福多，心情愉快朋友多，身体健康快乐多，财源滚滚钞票多，年年吉祥如意多，祝愿好事多多多,3
元霄节到，春节停止呼吸了，我的祝福没迟到！不管去年如何，相信今年你努力有更大回报！最重要的是，愿你健康幸福乐逍遥！祝元宵节快乐！,3
元宵节送您一碗汤圆，将圆起一场事业的美梦，圆出温暖如春的爱情，圆得家人幸福的团聚，圆来新一年精彩的运程！元宵快乐！,3
有灯无月不娱人，有月无灯不算春。春到人间人似玉，灯烧月下月如怠。满街珠翠游村女，沸地笙歌赛社神。不展芳尊开口笑，如何消得此良辰。,3
风柔，雨润，花好，月圆，幸福生活日日甜；冬去，春来，似水，如烟，一年佳节在眼前！说声珍重，道声平安，祝您元宵快乐健康，恭喜发财！,3
就是现在，用我最真切的思念。让风捎去满心的祝愿，给我生命中不可多得的你愿你拥有一个幸福快乐的元宵节,3
盏盏花灯报元夜，岁岁瑞雪兆丰年，玉烛长调千户乐，花灯遍照万家春，祝我亲爱的朋友，元宵节快乐,3
汤圆是圆的，包裹着甜蜜浓缩着思念月儿是圆的，有你一生不遗憾真想梦也是圆的，陪你走过一年又一年,3
元宵节将至，国务院发五条禁令：禁止假装忙不理我禁止发财忘了我禁止有难不帮我禁止吃饭不叫我禁止闲时不想我要求狠抓落实,3
曾经，有一碗甜蜜的汤圆放在我的面前，我没有珍惜，等我失去的时候我才后悔莫及，舌齿间最痛苦的事莫过于此元宵节，吃汤圆了吗,3
月到十五分外圆，把你疼爱把你怜，常常把你挂心间，今夜的汤圆甚是粘，我们何时能团圆。,3
这世界上什么最甜？你煮的元宵。世界上什么最最美？和你一起观赏的月亮。元宵佳节，我吃着你煮的元宵和你一起赏月,3
十五的月儿圆又圆，给你全家拜个年！家好运好人也好，幸福美满更团圆！,3
愿你在2009年的365天天天开开心心，8760小时时时快快乐乐，525600分分分精彩！元宵节快乐,3
元宵佳节不送礼，发条短信祝福你：健康快乐长伴你，好运和你不分离，最后让我告诉你，钞票滚滚进袋里，好处全都送给你。,3
每年农历的正月十五日是中国的传统节日元宵节。正月是农历的元月，古人称夜为“宵”，所以称正月十五为元宵节。正月十五日是一年中第一个月圆之夜，也是一元复始，大地回春的夜晚，人们对此加以庆祝，也是庆贺新春的延续。元宵节又称为“上元节”。,3
元宵上市红灯照，玉烛长调千户乐；月当五夜，花灯遍照万家春。,3
十五的月儿圆又圆，我来向你拜个年！家好运好人也好，幸福美满更团圆！,3
花灯、月下，我想你！赏月、观灯，我候你！月圆、汤圆、缘梦圆！梦团圆，梦团圆！,3
你圆，我也圆，事也圆圆，人也圆圆。天也圆圆，地也圆圆。愿此元宵佳节，大家都能好梦圆圆。,3
风潇潇，雪寒寒，花好月圆圆圆团，花灯红火挂满街，元宵寄相思，来去心声和祝愿，愿缘亲友每个团“圆”梦。,3
元宵寄相思，花好月圆人团圆，群灯争艳你最“艳”。寄去相思和祝愿，网中情缘缘“圆”。,3
午夜人散尽，花好月圆家人团圆，群灯吐艳你最“好”。寄去相思和祝愿，网中情缘愿梦“圆”。,3
我思我想我知道，我不能伴在你的身边。我念我行我知道，我能做的只有遥远的思念。你快乐吗？你幸福吗？我默默祝福你。,3
我思我愿千万个思念，在空气中凝固。我念我想扬起风飘向你，带着我的祝福，寂寞我不在乎，你快乐我就满足，想你是我的幸福！,3
天地有谁知，但愿你知道，有个人时时惦念着你。元宵节的灯火，是我的祝愿，是你含笑传情的眼睛，它缀在我的心幕上，夜夜亮晶晶。,3
我的心我祝我愿，真诚地为你祝愿：愿你在这一年里平安、快乐。,3
带着满满相思，带着满满祝福，带着温馨祈愿，祝福你元宵节快乐。,3
一年一度良宵好，淑气鸿喜千家乐，彩灯春花万户新。,3
玉宇无尘，我欲乘风飞去，月明碧玉三千里；银河散影，良宵点点，人醉春风十二楼。,3
三五良宵，齐聚良明，花灯吐艳映新春；一年守望，万家灯火，明月生辉度佳节。,3
灯火良宵，鱼龙百戏；团团圆圆，穿红挂绿；琉璃盛世，锦绣三春。,3
片片雪花飞，宵夜短，日上五竿长，时际上元，玉烛长调千户乐；月当午夜，花灯遍照万家春。,3
春夜短，白白元宵度；春夜灯花，几处笙歌腾朗月；良宵美景，万家箫管庆丰年。,3
推开窗门瑞雪寒，一年一度元宵开。雪月梅柳开新春，花鼓龙灯闹元宵。,3
人人报平安，一曲笙歌春似海，万家灯火夜如年。,3
一宵寒暑一万年，暧间好似度华年。灯火万家，良宵美景；笙歌一曲，盛世佳音。,3
户户团圆，家富人寿，月圆年丰。,3
元宵夜连连，万户雪花开。欢歌笑语，千家把酒赏花灯。,3
元宵的灯火同天上的月亮在争相放映着光芒，新年的祝福在这里休憩并走向永远，小小的汤圆包裹着幸福送入你的心间。元宵节祝您合家欢乐！,3
远看灯街比星光灿烂，似串串珍珠如无线乐谱，五彩斑斓。近视欢歌劲舞雄狮跃，似潮流涌动如八仙过海，热闹非凡。鼓声激励朋友前进的步伐，红灯照亮你似锦的前途。祝你元宵节快乐！,3
花开花落花满天，春日春景春风爽，福多财多好运多，风顺雨顺事事顺，忙忙碌碌为工作，开开心心过元宵。祝您万事如意，心想事成！,3
圆月高悬看世间，惊叹人间聚团圆。亲情友情爱无限，甜蜜和美喜乐天。难怪嫦娥都羡眼，仙女都愿往人间。自亏我月广寒宫，仙境不如俗世昌。愿你十五觅女仙，美女朋友把你伴！,3
月圆听风清，宇静寻芳情，十五佳境。且看知音犹在，老友喜相逢。风雪蒙，泪烛明。盼佳人，歌舞升平。念今宵夜浓，诚邀玉兔，下凡祈恒梦。亲，节日快乐！,3
圆圆锅子煮汤圆，圆圆心情庆团圆，彩灯挂起阖家欢，愿你记住每一份甜。甜蜜包裹在糯米里，幸福常留在你心间。祝大家元宵节快乐！,3
元旦除夕没谋面，宵夜早茶没约见，节前假后没做伴。元宵佳节送你点啥？送上短信带上祝福，愿你抱平安、拥健康、揣幸福、携快乐、牵财运、元宵快乐！,3
圆圆圆圆圆圆滚滚的元宵节就要到了，滚滚滚滚滚滚烫的祝福送给你了，提前祝你兔年元宵花好月圆、合家团圆、幸福快乐、圆圆满满。,3
汤圆粘，人团圆，红烛花灯闹佳节，欢乐阖家欢。鞭炮声声笑开怀，渐无语，星阑珊，月光如水照无眠。元宵春风暖。祝元宵节愉快！,3
要一家人看着福想着祝。看看今天的月亮圆不圆。看家人团不团圆。看天上的星星满不满。看碗里的元宵是不是很满。元宵佳节看每句最后一个字1,3
元宵佳节不送礼，发条短信祝福你：健康快乐长伴你，好运和你不分离，最后让我告诉你，钞票滚滚进袋里，好处全都送给你。元宵节快乐！,3
紫气东来龙头抬，元宵祝福早送来：欢欢喜喜欢喜年，开开心心开心年。平平安安平安年，健健康康健康年。快快乐乐快乐年，团团圆圆团圆年！,3
十五的月儿圆；桌上的元宵圆；父母的恩情圆；夫妻的感情圆；子女的孝心圆；济济一堂的亲情圆又圆！祝你全家元宵节快乐！,3
灯耀人面夜如昼，烟花爆竹绽清流，龙腾狮舞闹上元，锣鼓喧天响宇宙，呼朋唤友结伴行，人潮涌动挤街头，彩灯谜语欢歌骤，春风邀君元宵游。元宵节快乐！,3
元宵到，送你一盏彩灯，愿照亮你幸福的家庭，照亮你光辉的前程，照亮你甜蜜的爱情，照亮你红火的日子，照亮你健康的身体，照亮你平安的一生！,3
年年元宵年年圆，年年花灯年年转；家圆人圆幸福圆，团团圆圆；财转情转事业转，时来运转；愿愿随愿月儿圆，事事随心汤圆甜。元宵快乐！,3
点一盏明灯，写一句祝福，放在平安的湖，包一颗元宵，送一句问候，发往幸福的你，元宵佳节，祝你全家团圆，健康快乐。,3
新年过完，一切皆散，没得再玩，要去上班，辛苦赚钱，节日不闲，元宵来伴，月圆人圆，衷心祝愿，身体壮健，钱途无限，幸福无边！,3
吃过喜庆的水饺，吃完长寿的面条，迎来团圆的元宵。元宵佳节马上到，亲手包只元宵送给你，我已经为你包进平平安安，包进顺顺利利，包进团团圆圆！,3
元宵节到，送你一份宵夜大餐：喜悦菜，团圆羹，美满饭，祝福汤，外加四个热元宵，分别写着“心想事成”，包你吃出牛年吉祥，阖家团圆！,3
元宵节到了，特意为你做了一锅“幸福汤圆”其中一个真心馅一个关怀馅一个吉祥馅一个如意馅一个快乐馅一个健康馅一个福气馅一个甜蜜馅。祝你元宵节快乐。,3
天边的繁星闪烁，眼前的华灯缤纷。快乐的谜底万千，心中的祝福斑斓。锅中的汤圆柔滑，碗中的甜汤醇厚。幸福的团圆不断，真诚的问候绵绵。元宵节快乐！,3
满满的月儿圆圆的脸，闪闪的烟花美美的灯，甜甜的汤圆密密的你，短短的信息深深的情，满满的祝福默默的我，愿你有棒棒的身体乐乐的笑！元宵快乐！,3
人生有如冬奥赛场：上半场按学历、职位、薪金，有如空中技巧比上升；下半场按血压、血脂、血糖，有如跳台滑雪比下降。元宵祝你有如王鳎永远是赢家！,3
千万人之中，遇见我要遇见的人。于千万年中遇见我要遇见的人，没人早一步，也没有迟一步，遇上了也只能轻轻的说一句，哦原来你在这里。元宵佳节祝福你健康快乐,3
元宵节，放烟花：有玫瑰，成双成对；有玉兰，万事不难；有茉莉，好运随你；有秋菊，年年有余；有杜鹃，红红火火；有牡丹，一生富贵。元宵快乐。,3
让我的短信带着快乐飞向你的梦乡，让我的短信伴着好运降落到你的身旁，让我的短信携着幸福流淌在你的心房，让我的短信捎给你元宵的吉祥！元宵快乐！,3
为你煮碗汤圆，加上幸福，和着心愿，给你最温暖的元宵祝愿，让阵阵初春的晚风吹拂你的心田，让手机铃声轻响我的思念，祝福你元宵快乐，生活顺心。,3
十五快乐，希望你，快乐是分分秒秒快乐，健康是平平安安，开心是时时如意，财富是日积月累，事业是平步青云，朋友是快乐有佳，做2013最幸福的人！,3
晨曦中最温暖的那缕阳光就是我对您最真挚的祝福，夕阳西下时最夺目的那末红霞也是对您最热诚的祈祷：牛年元宵节，祝您牛气冲天！,3
元宵到，亲手为你包汤圆：包上芝麻，祝你升迁发达；包上红糖，日子甜蜜芳香；包上红枣，生活步步高。一条短信，把祝愿带到，祝你元宵节快乐！,3
床前明月光，祝福响当当，幸福和安康，永在你身旁，好运伴吉祥，开心欢歌唱，元宵喜洋洋，财运喜气旺，开心笑语淌，牛年你最棒。元宵节快乐！,3
元宵将至，没什么可以送你的，于是挑来几担快乐，扛来几袋幸福，装来几盒鸿运，运来几筐好心情作为配料，包进团圆汤圆里送给你，祝元宵快乐甜蜜！,3
