中秋迈着优雅的步伐，从皎洁的月光中走来，哼着团圆吉祥的调子，唱着幸福安康的歌词，真心为你演奏着一句最真诚的祝福：花好月圆，快乐平安。,1
送你一轮圆圆的月，思念为圆心，关怀长围绕；送你一个圆圆的饼，幸福为圆心，好运长环绕；送你一句圆圆的祝福，真诚为圆心，友情长围绕。中秋快乐！,1
明月是大海的魂魄，将无边幸福洒向天涯海角；中秋是明月的魂魄，将美好团圆送给千家万户；祝福是中秋的魂魄，将真诚祝愿寄到你的心间。中秋快乐！,1
明月如霜照桂花，遥送祝福到你家。中秋思念圆似月，情意拳拳无断绝。月饼飘香九州欢，幸福吉祥绕身边。最真最诚表心意：佳节快乐朋友寄。,1
中秋节到了，别忘和家人一起畅饮快乐月光酒，品尝好运桂花饼，倾听团圆海潮曲，观赏平安枫叶舞，享受幸福好日子，收看朋友祝福信：中秋快乐！,1
风干月光，把日子酿出美妙韵味；剪裁海潮，把思念裹出浪花味道；珍藏繁星，编织一串幸福珠宝，在中秋的时候把这一切送给你，愿花好月圆包围你！,1
秋初凉，夜苍黄，一份思念两茫茫；中秋到，月明亮，提早祝福情飞扬；好运享，快乐尝，吉祥月饼到身旁；朋友心，情意长，祝你幸福团圆永安康。,1
友情如山，把关怀送给你；岁月如风，把快乐送给你；花落如雨，把馨香送给你；月明如雪，把真情送给你。中秋将至，提前将祝福送给你，祝中秋快乐。,1
许一个心愿，祝你快乐平安；送一份真情，愿你吉祥如意；发一条短信，告你中秋来临；写一段文字，我们彼此珍藏。中秋佳节，共享团圆。,1
月是中秋分外明，我用短信传真情；相思包着财运到，幸福裹着福运跑；浪漫甜蜜融其中，天天相伴好心情；借问月饼知多少？短信一条不能少。,1
以一种【中】坚力量的姿态，站在【秋】高气爽的满月下，【节】庆的氛围异常浓烈，听见你【快】马加鞭赶路的声音，我【乐】不思蜀只想留在你怀里。,1
中秋圆月挂天上，你思我想月饼香。故乡的山故乡的水故乡的人，异乡的思异乡的念异乡的情。故乡的牵挂，异乡的祝福，空中的月饼，请你都收下：中秋快乐！,1
用红色的热情牵引，橙的幸福做皮，黄色的快乐做馅，绿色的健康之水，给予青色的幸运，蓝色的财运，紫的福运点缀，加上我百分之二百的诚意，送给你百分之百吃了就走运的彩虹月饼。中秋节快乐！,1
今年中秋节，将出现千年一遇的奇观：七心伴月。这条短信就是参观券，祝你朋友知心、爱人知心、生活随心、事业顺心、健康放心，事事称心，天天开心！,1
警告：你的藏身之处已经暴露，并被卫星定位锁定，一种精确制导的武器已经启动，正以掩耳不及盗铃之势，向你急驰而来。别紧张，这是给你的中秋祝福！,1
我冒着手机没电的危险，顶着网络塞车的风险，跨过信号屏敝的天险，忍受电磁辐射的凶险，突破月黑风高的艰险，终于成功送出这条祝福：中秋快乐！,1
非常荣幸邀请你及家人出席中秋夜宴，菜单如下：红烧快乐，火爆开心，油炸浪漫，清蒸健康，水煮团圆，干煸四季欢乐豆，烘烤友情黑面包，谢拒自带月饼！,1
中秋月儿圆，全国人民大团圆。中秋心儿圆，阖家欢乐人团圆。中秋梦儿圆，愿愿随心心愿圆。中秋事儿圆，心想事成圆圆圆！中秋节，送你祝福的同心圆！,1
我是清风你是烟，追追赶赶永向前。我是风筝你是线，牵牵绊绊总相连。我是月饼你是馅，缠缠绵绵抱成团。我是明月你是泉，明明白白在心田！中秋快乐！,1
以真诚为圆心，以理解为半径，画出友情的圆。以缘份为圆心，以浪漫为半径，画出爱情的圆。以关怀为圆心，以感动为半径，画出团圆的圆。中秋节快乐！,1
错过了太阳的辉煌，还有月亮的静谧。错过了流星的花园，还有月色的荷塘。错过了七夕的浪漫，还有中秋的团圆。人生不一定圆满，与你举杯邀月就无憾！,1
中秋点歌：点一首《白月光》，收入丰厚月月光；点一首《十五的月亮》，十五的月亮十六圆；点一首《月亮代表我的心》，月亮的脸偷偷地在改变！,1
中秋之际，我谨代表宇宙共和国、外太空省、银河市、太阳镇、地球村和嫦娥、玉兔、月老等知名人士，向你并通过你向你的家人、朋友致以最诚挚的问候！,1
丰收这幸福做陷，聚集这快乐做皮，取这天上的月亮为模型，为你做这世界上最为圆满的月饼，希望你中秋佳节人月两团圆，中秋节快乐。,1
也许钞票不够爱你，但阳光会总照耀着你；也许朋友你不够多，但今晚的满月属于你。8月15中秋节，愿最美的月光带给你最美的心情、最美的未来！,1
八月十五月儿圆，发条短信表祝愿：亲人友人常团圆，爱人恋人爱不断，恩人贵人总出现，敌人仇人永不见，幸福快乐到永远！,1
江山易变，情字难改，春去秋来，花谢花开伴随着微寒料峭的秋风，佳节中秋即将到来，放不开思念你的情怀，节日里祝你扫掉阴霾，舒心畅快,1
月很圆，花更香，保重身体要健康；雨在游，鸟在叫，愿你天天哈哈笑；手中书，杯中酒，祝你好运天天有！欢乐多忧愁少，祝你中秋节快乐！,1
月是故乡圆，情是故人浓。我心写我思，托海生明月，寄天边清风，以心的频率，在思念中向你传递。若感受到幸福的共振，请调到815频道，接收这祝福的信号！,1
天文预报显示：今年中秋节当晚的圆月升得特别高，月出至月落的时间超过小时，赏月时段是本世纪以来最长的。当时分左右月上中天时，月色会显得更明更亮，是赏月最佳时刻。,1
一生相识，来自天意；一份真情，来自秋季；一份美丽，来自惦记；一句祝福，来自心底，愿健康平安快乐幸福永远伴随您。祝国庆、中秋节快乐！,1
明月圆，桂花香，祝你永远都健康；鱼儿游，鸟儿叫，愿你天天哈哈笑；水中花，杯中酒，愿你好运常常有！幸福多，烦恼少，祝你中秋快乐多！,1
中秋将至，奉上一个月饼，配料：五克快乐枣，一把关心米，三钱友情水，用幽默扎捆，用手机送达；保质期：农历八月十五前；保存方法：请按保存键。,1
停电通知：今接上级通知，为了我们的明天更美好，为了我们的地球更长寿，特决定中秋节当天停电一天，由月亮执班，亲爱的，我们一起陪陪它吧，它多孤单啊！,1
采一轮荷上明月供你观赏，织一件秋日的清凉为你披上，斟一杯月宫的琼浆醉你心上，做一份中秋的祝福圆你梦想，中秋佳节祝您全家团团圆圆，幸福安康。,1
发这条短信，主要是想提醒你，中秋节快到了，月饼准备好了吗？心情准备好了吗？最重要的是，请我吃饭准备好了吗？呵呵，提前祝你中秋快乐！,1
中秋温馨提示：别贪杯，让美酒将自己灌得烂醉；别贪吃，让月饼将自己撑得崩溃；别贪钱，舍不得转条祝福跟朋友共品味。提前祝你中秋快乐！,1
鉴于你在我心目中至高无上的尊贵地位，我决定抢个先，提前向你发去中秋贺电：薪水狂翻倍，工作不受累，花好月圆美梦随，心想事成幸福陪。,1
一轮明月千里共，一声祝福遥相送。皎皎秋影金波重，淡淡桂花佳期逢。中秋人月两团圆，幸福花儿别样红。家圆事圆济沧海，财源福源紧随同。,1
中秋到了，不要迷恋哥，哥只是传说；不要迷恋姐，姐已经变成嫦娥；不要迷恋月饼，月饼只是个包装盒；迷恋我的短信吧，能带给你节日的快乐！,1
月饼飘香，桂花芬芳，中秋明月轻敲窗；美酒酣畅，焰火奔放，朋友祝福到心上。家圆，人圆，事圆，好梦花好月圆；财缘，福缘，情缘，幸福与你结缘,1
这个中秋太疯狂了，月老竟给你牵红线了，广寒宫变成新房了，玉兔给嫦娥当伴娘了，新郎你也官复原职，再任天篷元帅了。我不得不祝你：中秋快乐！,1
月升代表我的牵挂，月落代表我的关怀，月盈代表我的惦记，月亏代表我的思念，月芽代表我的真诚，月弯代表我的微笑，月圆代表我的祝福。中秋节快乐！,1
中秋节到了，我代表月光一族，祝你：月薪加倍，月月发财，月进斗金，月月有余，住月宫级别墅，吃钻石级月饼，再来一张金卡级月票，提供无限期透支！,1
剪一片快乐云裳，衬托你的微笑脸庞；裁一段好运月光，呵护你的甜蜜梦乡；裹一缕平安饼香，温暖你的幸福心房。中秋思念长，祝福更吉祥。,1
趁着时间还不是很急，心儿还不是很乱，夜色还不是很浓，月亮还不是很圆，我要迫不及待地送出一份祝福，赶在中秋到来之前，与你共同分享一份喜悦！,1
四季交替有了金秋的美丽，岁月流转有了想你的心情，短信传递有了问候的美丽，中秋来临有了真诚的祝福：愿你人生梦想圆，合家团聚笑开颜。,1
有三个好消息要告诉你：一是中秋节就要到了，我提前祝你节日快乐；二是中秋节月亮又亮又圆，可以免费欣赏；三是你如果送我礼物，我一定不会拒绝。,1
昔日明皇梦月宫，广寒请虚始落成。从此民间有祭月，而今形成赏月风。月圆饼圆人更圆，举国同贺莫等闲。一声祝福随我愿，短信传情寄万千。,1
月儿圆圆照我心，月下为你许三愿：一愿美梦成真，如愿所得；二愿日子甜美，合家欢乐；三愿貌美如仙，人人羡慕。最后祝你中秋佳节快快乐乐。,1
八月金秋桂送香，十五明月情溢边。丹桂香郁是千里，明月寄情是惬意。一缕香入魂，乐在此中行，为你行，为我行，快乐随行。为你行，为我行，祝福行！,1
一曲情歌一起听；一个浪漫一生有；一份牵挂一世情；一轮明月一相思；一块月饼一丝甜；一个中秋一起过；一个人生我和你！,1
窗前明月光，月饼有点脏；疑是手没洗，皱眉自思量。举头望明月，明月正照窗；低头细查看，原来没包装。中秋祝你，吃饼快乐，赏月开心！,1
中秋佳节眼看要来，嫦娥仙子繁忙无奈。特招工作助理一名，要求：喜欢兔子，爱吃月饼。面试方式：发短信至本机，内容为“中秋请你吃饭”。,1
中秋佳节至，快乐答试题。填空：名扬古今外，情溢春夏冬，若是马加鞭，定能在其中。答案：中秋快乐。中秋来临，祝你好运。,1
我在脚下画了下点，叫圆心；我用真诚、尊重划线，叫半径。我用圆心和半径组合成个圆，只为在中秋之际送你个圆圆的祝福：愿你月圆人更圆！,1
幽夜，倚窗，抬头，望月，明月装饰了你的窗子，你装饰了我的梦；长空，繁星，相思，轻风，繁星点缀了我的思念，我许下了美好的心愿，愿你中秋快乐。,1
分分喜悦无忧，刻刻高兴欢喜，时时活泼开朗，日日蒸蒸日上，月月事事顺心，年年吉祥如意！金秋佳节，祝您人圆家圆，业顺事兴！,1
中秋祝您，月圆人圆心圆；中秋愿您，饼圆脸圆眼圆；中秋望您，家圆事圆情圆；中秋让你，圆梦万事圆！,1
八月十五不送礼，发条短信祝福你，健康快乐唱伴你，好运和你不分离，还有让我告诉你，财神已经跟随你，钞票珠宝都给你，幸福人生属于你，中秋节快乐！,1
你要敢中秋节不快乐，我就把你的脸打成彩屏的，脑袋打成振动的，耳朵打成和弦的，全身打成直板的，你再郁闷就打成折叠的，如果还敢就把你打成二手的！,1
中秋来临百花香，一条信息带六香一香送你摇钱树，二香送你贵人扶，三香送你工作好，四香送你没烦恼，五香送你钱满箱，六香送你永安康。中秋快乐！,1
把酝酿已久的创意交给秋风，任其去演绎相思的旋律；让企盼团聚的心跃上太空，在月宫桂树下再续永恒的主题。中秋佳节来临之际，愿你心情如秋高气爽，笑脸如鲜花常开！,1
家乡的月亮总比外面的圆，家乡的月饼总比外面的甜，中秋将至，不能回家团圆，给家乡的亲戚朋友送出我的祝福：中秋快乐！,1
用我的拥抱换你的转身，只需要一瞬间的决定，还有一秒钟的眼神，中秋到了，圆满的日子也就来临了，给团圆一个空间！,1
中秋时节，我对你浓浓的思念，都化作一条条简短的信息，穿过三千尺的高空，然后折返回来，轻轻告诉你：中秋节快乐！,1
一百个人对中秋会有一百个理解，一百个人对团圆会有一百个向往，一百个人对圆满会有一百个憧憬，我对你的关怀和思念永远都只有一种，那就是：我希望你过的好！,1
秋风清，秋月明，祝你天天好心情；桂花香，皓月亮，愿你事事都顺畅；笙歌响，糕饼香，送你如意加吉祥；中秋节祝你合家欢乐、幸福如意。,1
中秋到了，祝福来了，烦恼不见啦，好运相伴啦，忙碌疲倦没影啦，悠闲自在露面啦，幸福与你约会啦，福气把你包围啦，开心幸福没完没了啦,1
又到一年中秋夜，月下为你许个愿，一愿美梦定成真，二愿生活比蜜甜，三愿你我更年轻，四愿亲友心相连，每逢佳节倍想你，遥望明月寄思念,1
月到中秋分外明，情到深处分外浓，中秋佳节赏明月，老少男女吃月饼愿你在新的岁月里团团圆圆，和和美美过日子。,1
快乐在聚集，心花怒放美好在酝酿，幸福无比吉祥在闪光，好运连连平安在祈祷，福寿无边朋友在祝福，日子美美。愿你中秋快乐，万事大吉,1
八月十五月儿圆，照得九州皆团圆。亲朋好友齐相聚，喝酒聊天笑不断。月饼甜甜细细品，幸福的生活甜心底。遥望明月心祈愿，祝你事事顺利幸福满中秋快乐,1
十五月亮当空圆，民风民俗聚团圆。老少围坐桌儿圆，分享甜蜜月饼圆。举杯共庆全家圆，同享家宴中秋圆。中秋节，愿你年年十五大团圆，和和美美满满圆。,1
月儿圆圆照人间，家家户户庆团圆。月饼甜甜快乐传，举杯共品开笑颜。亲朋齐聚度佳节，欢声笑语日子甜。句句祝福诉心愿，情意深重人缠绵。祝中秋快乐幸福，家庭团聚美满,1
月儿圆圆降吉祥，月饼甜甜传快乐，果品美食摆满桌，亲朋齐座共团圆，欢声笑语日子甜，举杯祝愿庆佳节，送上一份小祝福，中秋快乐福无尽，合家欢乐伴美满。,1
举杯邀月，把酒言欢，乐在中秋繁星点点，月饼甜甜，美在中秋欢声笑语，盈盈笑脸，笑在中秋亲朋聚会，人月皆圆，爱在中秋祝你美满，不止中秋,1
中秋佳节快到来了，到时你也该出现了，否则月儿也不圆了，月饼吃了也不甜了，请别再忙挣大钱了，该是回家露个面了，你我也能叙团圆了。盼共度中秋,1
月儿欲圆情欲浓，桂花香醇飘思念嫦娥起舞自迷离，玉兔一嗅万家福花好月圆庆中秋，共享佳节乐团圆祝你中秋节快乐，阖家欢乐人团圆。,1
八月十五月儿圆，家家户户笑盈盈亲朋满座心欢喜，团圆喜庆乐陶陶赏月品茶乐逍遥，吃口月饼甜又香祝你中秋节快乐，日子红火享幸福,1
一天中总有些事情不会忘记，一年中总有些日子不会忘记，一生中总有些朋友不会忘记。中秋是一年中最重要的一个日子，而你是我一生中最重要的一个朋友。所以，在这个特别的日子里，祝你中秋快乐,1
中秋明月分外圆，千家万户共团圆，亲朋齐聚共赏月，花好月圆满笑颜，送上一份小祝福，徒添喜气伴幸福，中秋家合人团圆，幸福美满万年长，中秋快乐,1
团圆在月色中充满温馨，喜庆在月饼中品味甜蜜，幸福在百果盘里缤纷，快乐在酒杯里发酵，祝福在文字中跳跃，中秋佳节，愿你合家欢乐，幸福美满，中秋快乐,1
中秋明月照九州，举国欢庆家团圆。举杯共饮赏明月，情思绵绵涌心头。只愿明月总相伴，家家户户得团圆。人间再也无离散，欢声笑语尽开颜。短信一条送祝愿，愿你合家团圆幸福伴,1
一杯香浓的美酒凝聚着浓浓的情感，一块甜甜的月饼蕴藏着甜甜的祝愿，一轮圆圆的明月寄托着圆圆的希望。中秋节到了，愿你合家团圆，幸福平安,1
中秋佳节思绪乱，思亲友盼团圆，举杯畅饮论生活之酸甜。明月枝头佳人伴，品月饼吐真言，喜笑颜开述人生之悲欢。短信发来祝愿，祝你中秋快乐喜团圆,1
中秋月圆花开放，团圆喜庆热闹闹亲朋团聚乐开怀，吃块月饼福气高举杯邀月同庆贺，把酒言欢表心意祝你中秋心情妙，自在惬意乐逍遥,1
中秋明圆月，天涯共此时，团聚的节日，思念的时刻。身在异乡的孩子祝老父亲身体康健儿子一定尽快回家看看。,1
又是中秋佳节时，每逢佳节倍思亲。欢聚一堂有几人，千里相思思几分多少温馨又重现，多少祝福挂心间。遥望皎洁明月里，但愿君能知我心。不尽的思念倾渲泄，借仙子广袖送友亲。中秋快乐,1
每到中秋倍思亲，无奈天涯共此时，触景生情泪欲滴，忙拿手机发信息。祈祷双亲身无恙，儿子一定去看您,1
中秋佳节已来到，心情舒畅乐陶陶欢歌笑语声声妙，家家团圆乐融融呼朋引伴赏明月，举杯同庆好佳节吃块月饼长精神，神清气爽好运来借片月光送祝福，绵绵情谊在其中祝你中秋节快乐，阖家欢乐幸福长,1
中秋到，祝福到。祝你：阖家团圆如中秋明月高悬，生活乐事如中秋葡萄串串，欢声笑语如中秋清风拂面，心里滋味如中秋月饼层层比蜜甜。而我的祝福就是中秋月华，千山万水阻隔不了它的执着，一定要到你的身边。,1
月亮圆，大家圆，祖国统一人心暖月饼圆，小家圆，万家灯火庆团圆桌子圆，凳子圆，家人团聚笑开颜。中秋佳节到，愿祖国团圆更强大，家家团圆生活比蜜甜,1
中秋歌一曲，幸福不见底中秋舞一段，生活更绚烂中秋话团圆，日子更美满中秋吃月饼，祝你康健甜蜜，顺遂太平,1
秋风秋雨，秋心秋情，一叶知秋，感悟满腔思念的情怀月圆饼圆，人圆家圆，一桌团圆，分享满心团聚的快乐祈愿祈福，还愿惜福，一国文明，传递世界思念的幸福亲爱的朋友，中国中秋到，愿身边所有人平安健康,1
皓月当空照九州，菊花绽放中秋到。举杯共饮桂花酒，齐享月饼聚团圆。秋风叶落送祝福，明月寄达我的情。祝你中秋喜乐怀，愿你十五美悦笑。中秋节快乐,1
烟花飞上了天，月亮鼓圆了脸，家人一起笑开了颜月饼吃到了嘴甜，笑话讲到了腰弯，团聚的日子不一般。中秋节，和家人一起的日子，再多的财富我也不换。,1
喜气盈门花开放，中秋月圆人团圆亲朋欢聚乐无穷，推杯换盏情谊浓吃块月饼福无边，送份祝福妙无穷祝你中秋节快乐，身心惬意乐逍遥,1
中庭满月后庭花，吟诗赏月话桑麻。偶有浮云遮望眼，不过柠檬一壶茶。一家老小聚成朋，酒来茶往杯不停。烟花散落满园静，祝福已至送心中。中秋快乐,1
中秋月圆人也圆，家家户户笑开颜。父母长辈在眼前，子孙满堂笑声甜。美酒佳肴全尝遍，月饼甜到心里边。共赏明月乐无边，祝福声声情谊绵。祝你合家团圆，开心无限,1
满院香气沁心脾，鲜花艳艳迎中秋举杯同饮幸福酒，月圆人全大团圆遥寄相思送祝福，一片丹心暖你心愿你中秋节开怀，日子逍遥似神仙,1
月照庭前桌案边，瓜果葡萄月饼甜。祭月拜天大团圆，民俗传统聚宴餐。团团圆圆一家亲，甜甜蜜蜜挥杯响。祝你十五喜满怀，全家齐乐度中秋。吉祥如意,1
中秋将团圆演绎，圆月将温馨渲染，月饼将日子甜蜜，美酒将幸福碰响，百果将快乐缤纷，文字将祝福传递，中秋节，愿你合家欢乐，幸福满满,1
中秋喜庆人团圆，我心思念欲正浓为业各奔难相逢，千里明月寄相思真挚祝福遥相送，愿君快乐永安康生活甜美事业顺，阖家欢乐人团圆。中秋快乐,1
八月十五月儿圆，中秋月饼味香甜，人间亲情永不变，家家户户喜团圆，把酒欢歌邀婵娟，幸福长久驻人间。祝中秋快乐,1
中秋佳节月儿明，你我在此喜相逢，指客架起连心桥，天南地北乐融融，师哥师姐同努力，短信小说表衷情。月有圆缺人聚散祈祷有缘能相见中秋快乐天天快乐,1
嫦娥舞，玉兔跳，中秋佳节到明月照，桂花俏，快乐把你抱好运来，健康绕，幸福来报道朋友情，祝福到，愿你日子美得呱呱叫。朋友，中秋快乐,1
中秋佳节月儿圆，圆出全家聚一堂桂花散香飘祥瑞，嫦娥送福美万年愿你福圆满家园花好月圆人团圆事业顺利步步高，阖家幸福永平安。祝你中秋节快乐,1
海上生明月，天涯共此时。供桌庭院中，祭月共举杯。团圆喜笑颜，赏月食甜饼。月圆人也圆，酒香花儿艳。中秋节祝朋友，家圆人圆事事圆，甜甜蜜蜜幸福园。,1
中秋十五月亮圆，家家户户聚团圆。和谐美满笑声传，玉兔闻讯看人间。甜蜜圆饼齐分享，美酒礼让长辈尝。人间亲情浓无限，羡慕人间大团圆。中秋节，玉兔祝你大团圆,1
八月十五月更圆，家家户户庆团圆。美酒佳肴数不尽，知心的话儿说不完。月饼圆圆情谊满，共赏明月把酒欢。天涯海角祝福送，愿你中秋快乐比蜜甜,1
八月十五月儿圆，家家户户庆团圆。月饼圆圆心里甜，幸福快乐乐无边果盘圆圆装的满，白果缤纷笑开颜美酒佳肴桌摆圆，祝福声声送不完。短信送来我祝愿，愿你中秋合家欢,1
咬上一口月饼，品味甜蜜，让快乐升华，喝上一口美酒，体味幸福，让开心浓郁，送上一条短信，附赠祝福，让欢乐开怀，中秋节，愿你合家欢乐，幸福美满,1
昔年八月十五夜，小桥流水合家欢。今年八月十五夜，独在异乡工厂间。西北望家惟祝愿，父老乡亲好梦圆。待到腊梅开花日，满载而归来过年。,1
天上有七星伴月，我祝愿福星，寿星，禄星，财星，喜星，文曲星，武曲星，七星伴你。天上有牛郎织女，我祝愿月老牵线，帮你找到牵手一生的人。中秋快乐,1
中秋月儿圆，人间庆团圆。月宫住神仙，虔诚拜月娘。香案摆当院，果蔬齐登场。香烛生光焰，元宝银币全。妇女孩童拜，祈福保平安。,1
月儿透窗洒祥瑞，花香酒醇情韵长相约桂花嗅余香，意迷情迷人更迷中秋佳节笑开颜，赏花赏月享团圆花好月圆福无疆，合家团聚喜洋洋。中秋快乐,1
相思树底说相思，中秋月夜话团圆问君哪得相思意，望穿秋水盼人归思郎恨郎郎不知，惟有圆月照我心树头结得相思籽，八月十五始团圆。又是一年中秋节，游子当归终须归，手头工作可以抛，等你一起吃月饼,1
暮云渐净圆月升，风颠云覆天地清遥望故居千里远，情思梦绕一念显可怜十五中秋夜，娥弈思恋痛千年浪子无奈游离外，万水千山意传情暗喜偶得三日闲，围坐月下话团圆又是一年中秋节，愿你合家团圆齐欢腾，共度中秋明月夜,1
中秋明月悬中天，全家老少庆团圆，其乐融融桌边坐，谈笑风生乐无边。传统佳节摆家宴，瓜果梨桃分外鲜，轻啖一口团圆饼，胜过王母蟠桃宴。人生难得几回欢，明月能有几回圆，若是亲人常聚首，此生不悔赛神仙。,1
中秋明月照九州，月光如洗添思念，父母家中日夜盼，游子归来眼欲穿。事业虽忙终有尽，高堂不在后悔迟，若能放下手中事，不妨想回家看看。同食月饼共赏月，合家团聚方尽欢，满堂欢笑共举杯，千家万户庆团圆,1
丰美的菊花，轻柔的月光 ，飘香的桂树，别致的月饼，团圆的场景，这是中秋佳节的五彩花篮。它洋溢着欢快的节奏，飘荡着愉悦的音符，流动着甜蜜的笑容，流露着恋恋的情思，愿如此佳节，天下人齐分享。,1
中秋佳节喜来到，清风圆月佳人照，月下赏月庆团圆，合家欢乐喜相连，月儿圆圆饼儿甜，幸福快乐福康安。,1
饱蘸中秋的月色，绘一幅故乡的山水图奏响中秋的琴弦，唱一首思念的咏叹调迈开中秋的舞步，跳一曲团圆的开场舞。祝中秋快乐,1
中秋邀明月，共赏花好月圆盛情约清风，共度团圆之夜举杯祝亲朋，合家幸福福寿全问候几多情，送不尽情意绵绵中秋佳节到，祝君快乐同行，笑声不停,1
